07:54:51.140263 IP 192.168.8.120.57900 > 192.168.8.1.53: 64924+ PTR? b._dns-sd._udp.0.8.168.192.in-addr.arpa. (57)
07:54:51.140428 IP 192.168.8.120.64624 > 192.168.8.1.53: 24736+ PTR? db._dns-sd._udp.0.8.168.192.in-addr.arpa. (58)
07:54:53.232456 IP 192.168.8.120.64419 > 34.237.73.95.443: Flags [P.], seq 2273545346:2273545634, ack 3026430256, win 2048, options [nop,nop,TS val 1893099870 ecr 1117340477], length 288
07:54:53.462172 IP 34.237.73.95.443 > 192.168.8.120.64419: Flags [.], ack 288, win 133, options [nop,nop,TS val 1117380748 ecr 1893099870], length 0
07:54:53.462390 IP 34.237.73.95.443 > 192.168.8.120.64419: Flags [P.], seq 1:326, ack 288, win 133, options [nop,nop,TS val 1117380748 ecr 1893099870], length 325
07:54:53.462442 IP 192.168.8.120.64419 > 34.237.73.95.443: Flags [.], ack 326, win 2042, options [nop,nop,TS val 1893100099 ecr 1117380748], length 0
07:54:53.630203 ARP, Reply 192.168.8.1 is-at 4c:50:77:d4:59:31, length 28
07:54:58.703208 ARP, Request who-has 192.168.8.120 tell 192.168.8.1, length 28
07:54:58.703227 ARP, Reply 192.168.8.120 is-at 38:f9:d3:6c:7c:7e, length 28
07:54:59.326926 IP 192.168.8.120.64361 > 104.18.23.110.443: Flags [P.], seq 2043940716:2043940745, ack 4205734999, win 4096, length 29
07:54:59.354976 IP 104.18.23.110.443 > 192.168.8.120.64361: Flags [.], ack 29, win 722, length 0
07:54:59.923367 IP 104.18.23.110.443 > 192.168.8.120.64361: Flags [P.], seq 1:26, ack 29, win 722, length 25
07:54:59.923465 IP 192.168.8.120.64361 > 104.18.23.110.443: Flags [.], ack 26, win 4095, length 0
07:55:03.716162 IP 192.168.8.120.64479 > 157.240.227.60.443: Flags [P.], seq 1105590137:1105590168, ack 3227005189, win 2048, options [nop,nop,TS val 1893110340 ecr 859539669], length 31
07:55:03.761852 IP 157.240.227.60.443 > 192.168.8.120.64479: Flags [.], ack 31, win 545, options [nop,nop,TS val 859566829 ecr 1893110340], length 0
07:55:04.112077 IP 157.240.227.60.443 > 192.168.8.120.64479: Flags [P.], seq 1:39, ack 31, win 545, options [nop,nop,TS val 859567054 ecr 1893110340], length 38
07:55:04.112140 IP 192.168.8.120.64479 > 157.240.227.60.443: Flags [.], ack 39, win 2047, options [nop,nop,TS val 1893110734 ecr 859567054], length 0

08:52:36.573518 IP 192.168.1.1.41161 > 255.255.255.255.7437: UDP, length 173
08:52:39.647866 IP 192.168.1.1.41161 > 255.255.255.255.7437: UDP, length 173
08:52:41.381876 IP 192.168.1.103.64866 > 52.114.74.220.443: Flags [P.], seq 3914943126:3914943185, ack 531335714, win 4096, length 59
08:52:41.525069 IP 52.114.74.220.443 > 192.168.1.103.64866: Flags [P.], seq 1:49, ack 59, win 2048, length 48
08:52:41.525142 IP 192.168.1.103.64866 > 52.114.74.220.443: Flags [.], ack 49, win 4095, length 0
08:52:41.584950 IP6 fe80::fc98:54ff:fef5:13a5 > ff02::1: ICMP6, router advertisement, length 24
08:52:42.000481 IP 0.0.0.0.68 > 255.255.255.255.67: BOOTP/DHCP, Request from e4:0e:ee:b8:0a:b6, length 322
08:52:42.097453 IP 0.0.0.0.68 > 255.255.255.255.67: BOOTP/DHCP, Request from e4:0e:ee:b8:0a:b6, length 322
08:52:42.097457 ARP, Probe 192.168.1.100, length 28
08:52:42.301946 ARP, Probe 192.168.1.100, length 28
08:52:42.404137 ARP, Request who-has 192.168.1.1 tell 192.168.1.100, length 28
08:52:42.609437 IP 192.168.1.1.41161 > 255.255.255.255.7437: UDP, length 173
08:52:43.019505 ARP, Probe 192.168.1.100, length 28
08:52:43.793582 IP 192.168.1.103.64871 > 104.18.22.110.443: Flags [P.], seq 4079610150:4079610179, ack 242898934, win 4096, length 29
08:52:43.816172 IP 104.18.22.110.443 > 192.168.1.103.64871: Flags [.], ack 29, win 511, length 0
08:52:43.837628 ARP, Probe 192.168.1.100, length 28
08:52:44.147312 IP 104.18.22.110.443 > 192.168.1.103.64871: Flags [P.], seq 1:26, ack 29, win 511, length 25
08:52:44.147384 IP 192.168.1.103.64871 > 104.18.22.110.443: Flags [.], ack 26, win 4095, length 0
08:52:44.862034 IP6 fe80::fc98:54ff:fef5:13a5 > ff02::1: ICMP6, router advertisement, length 24
08:52:45.068993 IP 104.18.22.110.443 > 192.168.1.103.64871: Flags [P.], seq 26:80, ack 29, win 511, length 54
08:52:45.069054 IP 192.168.1.103.64871 > 104.18.22.110.443: Flags [.], ack 80, win 4095, length 0
08:52:45.070215 IP 192.168.1.103.64871 > 104.18.22.110.443: Flags [P.], seq 29:87, ack 80, win 4096, length 58
08:52:45.078626 IP 104.18.22.110.443 > 192.168.1.103.64871: Flags [.], ack 87, win 511, length 0
08:52:45.681579 IP 192.168.1.1.41161 > 255.255.255.255.7437: UDP, length 173
08:52:48.753577 IP 192.168.1.1.41161 > 255.255.255.255.7437: UDP, length 173
08:52:49.481635 IP 192.168.1.103.65003 > 104.18.22.110.443: Flags [.], ack 1455017493, win 4096, length 0
08:52:49.494394 IP 104.18.22.110.443 > 192.168.1.103.65003: Flags [.], ack 1, win 68, length 0
08:52:51.008536 IP 52.114.15.7.443 > 192.168.1.103.65006: Flags [R.], seq 274905680, ack 463788155, win 0, length 0
08:52:51.825638 IP 192.168.1.1.41161 > 255.255.255.255.7437: UDP, length 173
08:52:53.016475 IP 192.168.1.103.65023 > 172.217.171.206.443: Flags [P.], seq 4187036233:4187036525, ack 3730875889, win 2048, options [nop,nop,TS val 1896568351 ecr 619861196], length 292
08:52:53.016916 IP 192.168.1.103.65023 > 172.217.171.206.443: Flags [.], seq 292:1710, ack 1, win 2048, options [nop,nop,TS val 1896568351 ecr 619861196], length 1418
08:52:53.016923 IP 192.168.1.103.65023 > 172.217.171.206.443: Flags [.], seq 1710:3128, ack 1, win 2048, options [nop,nop,TS val 1896568351 ecr 619861196], length 1418
08:52:53.016926 IP 192.168.1.103.65023 > 172.217.171.206.443: Flags [.], seq 3128:4546, ack 1, win 2048, options [nop,nop,TS val 1896568351 ecr 619861196], length 1418
08:52:53.016929 IP 192.168.1.103.65023 > 172.217.171.206.443: Flags [P.], seq 4546:5299, ack 1, win 2048, options [nop,nop,TS val 1896568351 ecr 619861196], length 753
08:52:53.060048 IP 192.168.1.103.65012 > 172.217.21.14.443: Flags [P.], seq 1361054201:1361054645, ack 3088660713, win 2048, options [nop,nop,TS val 1896568394 ecr 2325109295], length 444
08:52:53.060448 IP 192.168.1.103.65012 > 172.217.21.14.443: Flags [.], seq 444:1862, ack 1, win 2048, options [nop,nop,TS val 1896568394 ecr 2325109295], length 1418
08:52:53.060455 IP 192.168.1.103.65012 > 172.217.21.14.443: Flags [.], seq 1862:3280, ack 1, win 2048, options [nop,nop,TS val 1896568394 ecr 2325109295], length 1418
08:52:53.060456 IP 192.168.1.103.65012 > 172.217.21.14.443: Flags [.], seq 3280:4698, ack 1, win 2048, options [nop,nop,TS val 1896568394 ecr 2325109295], length 1418
08:52:53.060458 IP 192.168.1.103.65012 > 172.217.21.14.443: Flags [.], seq 4698:6116, ack 1, win 2048, options [nop,nop,TS val 1896568394 ecr 2325109295], length 1418
08:52:53.060460 IP 192.168.1.103.65012 > 172.217.21.14.443: Flags [P.], seq 6116:6991, ack 1, win 2048, options [nop,nop,TS val 1896568394 ecr 2325109295], length 875
08:52:53.060558 IP 192.168.1.103.65012 > 172.217.21.14.443: Flags [P.], seq 6991:7022, ack 1, win 2048, options [nop,nop,TS val 1896568394 ecr 2325109295], length 31
08:52:53.257638 IP 192.168.1.103.65023 > 172.217.171.206.443: Flags [P.], seq 3881:5299, ack 1, win 2048, options [nop,nop,TS val 1896568591 ecr 619861196], length 1418
08:52:53.293061 IP 192.168.1.103.65012 > 172.217.21.14.443: Flags [P.], seq 5604:7022, ack 1, win 2048, options [nop,nop,TS val 1896568626 ecr 2325109295], length 1418
08:52:53.431162 IP 192.168.1.103.64874 > 35.174.127.31.443: Flags [P.], seq 2440818735:2440819023, ack 3767085194, win 2048, options [nop,nop,TS val 1896568764 ecr 1387993252], length 288
08:52:53.466475 IP 172.217.171.206.443 > 192.168.1.103.65023: Flags [.], ack 292, win 291, options [nop,nop,TS val 619908806 ecr 1896568351], length 0
08:52:53.466494 IP6 fe80::fc98:54ff:fef5:13a5 > ff02::1: ICMP6, router advertisement, length 24
08:52:53.479616 IP 172.217.171.206.443 > 192.168.1.103.65023: Flags [.], ack 1710, win 303, options [nop,nop,TS val 619908834 ecr 1896568351], length 0
08:52:53.583976 IP 172.217.171.206.443 > 192.168.1.103.65023: Flags [.], ack 3128, win 314, options [nop,nop,TS val 619908853 ecr 1896568351], length 0
08:52:53.671287 IP 192.168.1.103.65012 > 172.217.21.14.443: Flags [.], seq 0:1418, ack 1, win 2048, options [nop,nop,TS val 1896569003 ecr 2325109295], length 1418
08:52:53.731058 IP 172.217.171.206.443 > 192.168.1.103.65023: Flags [.], ack 4546, win 325, options [nop,nop,TS val 619908871 ecr 1896568351], length 0
08:52:53.772326 IP 172.217.171.206.443 > 192.168.1.103.65023: Flags [.], ack 5299, win 336, options [nop,nop,TS val 619908881 ecr 1896568351], length 0
08:52:53.785557 IP 172.217.21.14.443 > 192.168.1.103.65012: Flags [.], ack 444, win 283, options [nop,nop,TS val 2325178183 ecr 1896568394], length 0
08:52:53.798734 IP 172.217.171.206.443 > 192.168.1.103.65023: Flags [P.], seq 1:383, ack 5299, win 336, options [nop,nop,TS val 619908901 ecr 1896568351], length 382
08:52:53.798804 IP 192.168.1.103.65023 > 172.217.171.206.443: Flags [.], ack 383, win 2042, options [nop,nop,TS val 1896569129 ecr 619908901], length 0
08:52:53.946037 IP 172.217.171.206.443 > 192.168.1.103.65023: Flags [P.], seq 383:964, ack 5299, win 336, options [nop,nop,TS val 619908901 ecr 1896568351], length 581
08:52:53.946101 IP 192.168.1.103.65023 > 172.217.171.206.443: Flags [.], ack 964, win 2038, options [nop,nop,TS val 1896569276 ecr 619908901], length 0
08:52:54.001019 IP 172.217.171.206.443 > 192.168.1.103.65023: Flags [P.], seq 964:1003, ack 5299, win 336, options [nop,nop,TS val 619908903 ecr 1896568351], length 39
08:52:54.001091 IP 192.168.1.103.65023 > 172.217.171.206.443: Flags [.], ack 1003, win 2047, options [nop,nop,TS val 1896569330 ecr 619908903], length 0
08:52:54.001597 IP 192.168.1.103.65023 > 172.217.171.206.443: Flags [P.], seq 5299:5338, ack 1003, win 2048, options [nop,nop,TS val 1896569330 ecr 619908903], length 39
08:52:54.060631 IP 172.217.21.14.443 > 192.168.1.103.65012: Flags [.], ack 1862, win 294, options [nop,nop,TS val 2325178201 ecr 1896568394], length 0
08:52:54.120877 IP 192.168.1.103.64874 > 35.174.127.31.443: Flags [P.], seq 0:288, ack 1, win 2048, options [nop,nop,TS val 1896569448 ecr 1387993252], length 288
08:52:54.143215 IP 172.217.21.14.443 > 192.168.1.103.65012: Flags [.], ack 3280, win 305, options [nop,nop,TS val 2325178220 ecr 1896568394], length 0
08:52:54.185046 IP 172.217.21.14.443 > 192.168.1.103.65012: Flags [.], ack 4698, win 316, options [nop,nop,TS val 2325178238 ecr 1896568394], length 0
08:52:54.348319 IP 172.217.21.14.443 > 192.168.1.103.65012: Flags [.], ack 6116, win 327, options [nop,nop,TS val 2325178258 ecr 1896568394], length 0
08:52:54.487930 IP 172.217.21.14.443 > 192.168.1.103.65012: Flags [.], ack 6991, win 338, options [nop,nop,TS val 2325178270 ecr 1896568394], length 0
08:52:54.500865 IP 172.217.21.14.443 > 192.168.1.103.65012: Flags [.], ack 7022, win 338, options [nop,nop,TS val 2325178271 ecr 1896568394], length 0
08:52:54.541744 IP 172.217.171.206.443 > 192.168.1.103.65023: Flags [.], ack 5299, win 336, options [nop,nop,TS val 619909023 ecr 1896568591,nop,nop,sack 1 {3881:5299}], length 0
08:52:54.603046 IP 172.217.21.14.443 > 192.168.1.103.65012: Flags [.], ack 7022, win 338, options [nop,nop,TS val 2325178360 ecr 1896568626,nop,nop,sack 1 {5604:7022}], length 0
08:52:54.629156 IP 172.217.171.206.443 > 192.168.1.103.65023: Flags [P.], seq 964:1003, ack 5299, win 336, options [nop,nop,TS val 619909142 ecr 1896568591], length 39
08:52:54.629227 IP 192.168.1.103.65023 > 172.217.171.206.443: Flags [.], ack 1003, win 2048, options [nop,nop,TS val 1896569951 ecr 619909142,nop,nop,sack 1 {964:1003}], length 0
08:52:54.642837 IP 172.217.21.14.443 > 192.168.1.103.65012: Flags [P.], seq 1:505, ack 7022, win 338, options [nop,nop,TS val 2325178453 ecr 1896568626], length 504
08:52:54.642907 IP 192.168.1.103.65012 > 172.217.21.14.443: Flags [.], ack 505, win 2040, options [nop,nop,TS val 1896569964 ecr 2325178453], length 0
08:52:54.655770 IP 172.217.21.14.443 > 192.168.1.103.65012: Flags [P.], seq 505:536, ack 7022, win 338, options [nop,nop,TS val 2325178456 ecr 1896568626], length 31
08:52:54.655832 IP 192.168.1.103.65012 > 172.217.21.14.443: Flags [.], ack 536, win 2047, options [nop,nop,TS val 1896569976 ecr 2325178456], length 0
08:52:54.741494 IP 172.217.21.14.443 > 192.168.1.103.65012: Flags [P.], seq 536:575, ack 7022, win 338, options [nop,nop,TS val 2325178456 ecr 1896568626], length 39
08:52:54.741555 IP 192.168.1.103.65012 > 172.217.21.14.443: Flags [.], ack 575, win 2047, options [nop,nop,TS val 1896570061 ecr 2325178456], length 0
08:52:54.741878 IP 192.168.1.103.65012 > 172.217.21.14.443: Flags [P.], seq 7022:7061, ack 575, win 2048, options [nop,nop,TS val 1896570061 ecr 2325178456], length 39
08:52:54.781698 IP 35.174.127.31.443 > 192.168.1.103.64874: Flags [.], ack 288, win 150, options [nop,nop,TS val 1388033580 ecr 1896568764], length 0
08:52:54.905075 IP 192.168.1.1.41161 > 255.255.255.255.7437: UDP, length 173
08:52:54.943909 IP 35.174.127.31.443 > 192.168.1.103.64874: Flags [P.], seq 1:326, ack 288, win 150, options [nop,nop,TS val 1388033581 ecr 1896568764], length 325
08:52:54.943978 IP 192.168.1.103.64874 > 35.174.127.31.443: Flags [.], ack 326, win 2042, options [nop,nop,TS val 1896570262 ecr 1388033581], length 0
08:52:54.983073 IP 172.217.21.14.443 > 192.168.1.103.65012: Flags [P.], seq 536:575, ack 7022, win 338, options [nop,nop,TS val 2325178704 ecr 1896568626], length 39
08:52:54.983161 IP 192.168.1.103.65012 > 172.217.21.14.443: Flags [.], ack 575, win 2048, options [nop,nop,TS val 1896570301 ecr 2325178704,nop,nop,sack 1 {536:575}], length 0
08:52:55.025428 IP 172.217.21.14.443 > 192.168.1.103.65012: Flags [.], ack 7022, win 338, options [nop,nop,TS val 2325178739 ecr 1896568626,nop,nop,sack 1 {0:1418}], length 0
08:52:55.038622 IP 172.217.171.206.443 > 192.168.1.103.65023: Flags [P.], seq 1:1003, ack 5299, win 336, options [nop,nop,TS val 619909478 ecr 1896568591], length 1002
08:52:55.038691 IP 192.168.1.103.65023 > 172.217.171.206.443: Flags [.], ack 1003, win 2048, options [nop,nop,TS val 1896570356 ecr 619909478,nop,nop,sack 1 {1:1003}], length 0
08:52:55.052396 IP 35.174.127.31.443 > 192.168.1.103.64874: Flags [P.], seq 1:326, ack 288, win 150, options [nop,nop,TS val 1388034051 ecr 1896568764], length 325
08:52:55.052468 IP 192.168.1.103.64874 > 35.174.127.31.443: Flags [.], ack 326, win 2048, options [nop,nop,TS val 1896570369 ecr 1388034051,nop,nop,sack 1 {1:326}], length 0
08:52:55.120821 IP 172.217.21.14.443 > 192.168.1.103.65012: Flags [P.], seq 1:575, ack 7022, win 338, options [nop,nop,TS val 2325179040 ecr 1896568626], length 574
08:52:55.120889 IP 192.168.1.103.65012 > 172.217.21.14.443: Flags [.], ack 575, win 2048, options [nop,nop,TS val 1896570436 ecr 2325179040,nop,nop,sack 1 {1:575}], length 0
08:52:55.134131 IP 172.217.171.206.443 > 192.168.1.103.65023: Flags [.], ack 5338, win 336, options [nop,nop,TS val 619909757 ecr 1896569330], length 0
08:52:55.231650 IP 35.174.127.31.443 > 192.168.1.103.64874: Flags [.], ack 288, win 150, options [nop,nop,TS val 1388034284 ecr 1896569448,nop,nop,sack 1 {0:288}], length 0
08:52:55.233149 IP 35.174.127.31.443 > 192.168.1.103.64874: Flags [P.], seq 1:326, ack 288, win 150, options [nop,nop,TS val 1388034531 ecr 1896569448], length 325
08:52:55.233178 IP 192.168.1.103.64874 > 35.174.127.31.443: Flags [.], ack 326, win 2048, options [nop,nop,TS val 1896570547 ecr 1388034531,nop,nop,sack 1 {1:326}], length 0
08:52:55.259540 IP 172.217.21.14.443 > 192.168.1.103.65012: Flags [P.], seq 536:575, ack 7022, win 338, options [nop,nop,TS val 2325179728 ecr 1896569976], length 39
08:52:55.259613 IP 192.168.1.103.65012 > 172.217.21.14.443: Flags [.], ack 575, win 2048, options [nop,nop,TS val 1896570573 ecr 2325179728,nop,nop,sack 1 {536:575}], length 0
08:52:55.273196 IP 172.217.21.14.443 > 192.168.1.103.65012: Flags [.], ack 7061, win 338, options [nop,nop,TS val 2325179780 ecr 1896570061], length 0
08:52:56.137580 ARP, Request who-has 192.168.1.103 tell 192.168.1.1, length 28
08:52:56.137598 ARP, Reply 192.168.1.103 is-at 38:f9:d3:6c:7c:7e, length 28
08:52:57.204027 IP 192.168.1.103.60548 > 195.226.228.72.53: 57483+ A? asimov.vortex.data.trafficmanager.net. (55)
08:52:57.357618 IP 195.226.228.72.53 > 192.168.1.103.60548: 57483 1/4/4 A 111.221.29.254 (232)
08:52:57.359277 IP 192.168.1.103.65025 > 111.221.29.254.443: Flags [S], seq 3646613143, win 65535, options [mss 1460,nop,wscale 6,nop,nop,TS val 1896572665 ecr 0,sackOK,eol], length 0
08:52:57.970740 IP 192.168.1.1.41161 > 255.255.255.255.7437: UDP, length 173
08:52:58.360608 IP 192.168.1.103.65025 > 111.221.29.254.443: Flags [S], seq 3646613143, win 65535, options [mss 1460,nop,wscale 6,nop,nop,TS val 1896573665 ecr 0,sackOK,eol], length 0
08:52:58.547128 IP 192.168.1.103.64884 > 31.13.69.60.443: Flags [P.], seq 1013139246:1013139277, ack 4022527190, win 2048, options [nop,nop,TS val 1896573851 ecr 194952174], length 31
08:52:58.956612 IP 192.168.1.103.64884 > 31.13.69.60.443: Flags [P.], seq 0:31, ack 1, win 2048, options [nop,nop,TS val 1896574260 ecr 194952174], length 31
08:52:58.989587 IP 31.13.69.60.443 > 192.168.1.103.64884: Flags [P.], seq 1:39, ack 31, win 478, options [nop,nop,TS val 194979232 ecr 1896573851], length 38
08:52:58.989656 IP 192.168.1.103.64884 > 31.13.69.60.443: Flags [.], ack 39, win 2047, options [nop,nop,TS val 1896574293 ecr 194979232], length 0
08:52:59.366122 IP 192.168.1.103.65025 > 111.221.29.254.443: Flags [S], seq 3646613143, win 65535, options [mss 1460,nop,wscale 6,nop,nop,TS val 1896574665 ecr 0,sackOK,eol], length 0
08:53:00.366272 IP 192.168.1.103.65025 > 111.221.29.254.443: Flags [S], seq 3646613143, win 65535, options [mss 1460,nop,wscale 6,nop,nop,TS val 1896575665 ecr 0,sackOK,eol], length 0
08:53:00.923692 IP 111.221.29.254.443 > 192.168.1.103.65025: Flags [S.], seq 1216813171, ack 3646613144, win 65535, options [mss 1440,nop,wscale 8,nop,nop,sackOK], length 0
08:53:00.923784 IP 192.168.1.103.65025 > 111.221.29.254.443: Flags [.], ack 1, win 4096, length 0
08:53:00.924755 IP 192.168.1.103.65025 > 111.221.29.254.443: Flags [P.], seq 1:518, ack 1, win 4096, length 517
08:53:01.025418 IP 192.168.1.103.65025 > 111.221.29.254.443: Flags [P.], seq 1:518, ack 1, win 4096, length 517
08:53:01.053295 IP 192.168.1.1.41161 > 255.255.255.255.7437: UDP, length 173
08:53:01.236129 IP 192.168.1.103.64993 > 172.217.171.196.443: Flags [P.], seq 2922643085:2922643569, ack 1988587613, win 2048, options [nop,nop,TS val 1896576533 ecr 1334760991], length 484
08:53:01.240103 IP 192.168.1.103.64991 > 216.58.211.196.443: Flags [P.], seq 591954616:591955038, ack 2816198559, win 4263, options [nop,nop,TS val 1896576537 ecr 3192958575], length 422
08:53:01.522980 IP 172.217.171.196.443 > 192.168.1.103.64993: Flags [.], ack 484, win 777, options [nop,nop,TS val 1334800390 ecr 1896576533], length 0
08:53:01.662475 IP 111.221.29.254.443 > 192.168.1.103.65025: Flags [P.], seq 2881:3767, ack 518, win 2051, length 886
08:53:01.662566 IP 192.168.1.103.65025 > 111.221.29.254.443: Flags [.], ack 1, win 4096, options [nop,nop,sack 1 {2881:3767}], length 0
08:53:01.676571 IP 172.217.171.196.443 > 192.168.1.103.64993: Flags [P.], seq 1:64, ack 484, win 777, options [nop,nop,TS val 1334800413 ecr 1896576533], length 63
08:53:01.676641 IP 192.168.1.103.64993 > 172.217.171.196.443: Flags [.], ack 64, win 2047, options [nop,nop,TS val 1896576971 ecr 1334800413], length 0
08:53:01.691014 IP 172.217.171.196.443 > 192.168.1.103.64993: Flags [P.], seq 64:95, ack 484, win 777, options [nop,nop,TS val 1334800414 ecr 1896576533], length 31
08:53:01.691077 IP 192.168.1.103.64993 > 172.217.171.196.443: Flags [.], ack 95, win 2047, options [nop,nop,TS val 1896576985 ecr 1334800414], length 0
08:53:01.697781 IP 192.168.1.103.64991 > 216.58.211.196.443: Flags [P.], seq 0:422, ack 1, win 4263, options [nop,nop,TS val 1896576991 ecr 3192958575], length 422
08:53:01.707441 IP 172.217.171.196.443 > 192.168.1.103.64993: Flags [P.], seq 95:134, ack 484, win 777, options [nop,nop,TS val 1334800414 ecr 1896576533], length 39
08:53:01.707504 IP 192.168.1.103.64993 > 172.217.171.196.443: Flags [.], ack 134, win 2047, options [nop,nop,TS val 1896577000 ecr 1334800414], length 0
08:53:01.707895 IP 192.168.1.103.64993 > 172.217.171.196.443: Flags [P.], seq 484:523, ack 134, win 2048, options [nop,nop,TS val 1896577000 ecr 1334800414], length 39
08:53:01.722047 IP 216.58.211.196.443 > 192.168.1.103.64991: Flags [.], ack 422, win 881, options [nop,nop,TS val 3193003257 ecr 1896576537], length 0
08:53:01.739423 IP 216.58.211.196.443 > 192.168.1.103.64991: Flags [P.], seq 1:363, ack 422, win 881, options [nop,nop,TS val 3193003296 ecr 1896576537], length 362
08:53:01.739497 IP 192.168.1.103.64991 > 216.58.211.196.443: Flags [.], ack 363, win 4257, options [nop,nop,TS val 1896577031 ecr 3193003296], length 0
08:53:01.768008 IP6 fe80::fc98:54ff:fef5:13a5 > ff02::1: ICMP6, router advertisement, length 24
08:53:01.788439 IP 216.58.211.196.443 > 192.168.1.103.64991: Flags [P.], seq 363:1099, ack 422, win 881, options [nop,nop,TS val 3193003297 ecr 1896576537], length 736
08:53:01.788505 IP 192.168.1.103.64991 > 216.58.211.196.443: Flags [.], ack 1099, win 4252, options [nop,nop,TS val 1896577080 ecr 3193003297], length 0
08:53:01.804387 IP 216.58.211.196.443 > 192.168.1.103.64991: Flags [P.], seq 1099:1306, ack 422, win 881, options [nop,nop,TS val 3193003298 ecr 1896576537], length 207
08:53:01.804432 IP 192.168.1.103.64991 > 216.58.211.196.443: Flags [.], ack 1306, win 4260, options [nop,nop,TS val 1896577095 ecr 3193003298], length 0
08:53:01.832236 IP 216.58.211.196.443 > 192.168.1.103.64991: Flags [P.], seq 1306:1345, ack 422, win 881, options [nop,nop,TS val 3193003298 ecr 1896576537], length 39
08:53:01.832292 IP 192.168.1.103.64991 > 216.58.211.196.443: Flags [.], ack 1345, win 4263, options [nop,nop,TS val 1896577122 ecr 3193003298], length 0
08:53:01.832729 IP 192.168.1.103.64991 > 216.58.211.196.443: Flags [P.], seq 422:461, ack 1345, win 4263, options [nop,nop,TS val 1896577122 ecr 3193003298], length 39
08:53:01.861564 IP 111.221.29.254.443 > 192.168.1.103.65025: Flags [.], ack 518, win 2051, options [nop,nop,sack 1 {1:518}], length 0
08:53:01.872064 IP 192.168.1.103.58900 > 195.226.228.72.53: 28763+ Type65? medium.com. (28)
08:53:01.872896 IP 192.168.1.103.60895 > 195.226.228.72.53: 38226+ A? medium.com. (28)
08:53:01.889983 IP 172.217.171.196.443 > 192.168.1.103.64993: Flags [P.], seq 95:134, ack 484, win 777, options [nop,nop,TS val 1334800648 ecr 1896576533], length 39
08:53:01.890037 IP 192.168.1.103.64993 > 172.217.171.196.443: Flags [.], ack 134, win 2048, options [nop,nop,TS val 1896577179 ecr 1334800648,nop,nop,sack 1 {95:134}], length 0
08:53:01.974946 IP 216.58.211.196.443 > 192.168.1.103.64991: Flags [P.], seq 1306:1345, ack 422, win 881, options [nop,nop,TS val 3193003547 ecr 1896576537], length 39
08:53:01.975023 IP 192.168.1.103.64991 > 216.58.211.196.443: Flags [.], ack 1345, win 4263, options [nop,nop,TS val 1896577263 ecr 3193003547,nop,nop,sack 1 {1306:1345}], length 0
08:53:02.061566 IP 192.168.1.103.65001 > 172.217.19.35.443: Flags [P.], seq 2603608384:2603608430, ack 270293537, win 2048, options [nop,nop,TS val 1896577349 ecr 497527142], length 46
08:53:02.061622 IP 192.168.1.103.65001 > 172.217.19.35.443: Flags [P.], seq 46:89, ack 1, win 2048, options [nop,nop,TS val 1896577349 ecr 497527142], length 43
08:53:02.061778 IP 192.168.1.103.65001 > 172.217.19.35.443: Flags [P.], seq 89:128, ack 1, win 2048, options [nop,nop,TS val 1896577349 ecr 497527142], length 39
08:53:02.062148 IP 192.168.1.103.65001 > 172.217.19.35.443: Flags [P.], seq 128:152, ack 1, win 2048, options [nop,nop,TS val 1896577349 ecr 497527142], length 24
08:53:02.062418 IP 192.168.1.103.65002 > 216.58.212.110.443: Flags [P.], seq 1337867809:1337867855, ack 2904355940, win 2048, options [nop,nop,TS val 1896577349 ecr 3139883609], length 46
08:53:02.062444 IP 192.168.1.103.65002 > 216.58.212.110.443: Flags [P.], seq 46:89, ack 1, win 2048, options [nop,nop,TS val 1896577349 ecr 3139883609], length 43
08:53:02.062461 IP 192.168.1.103.65002 > 216.58.212.110.443: Flags [P.], seq 89:128, ack 1, win 2048, options [nop,nop,TS val 1896577349 ecr 3139883609], length 39
08:53:02.062712 IP 192.168.1.103.65002 > 216.58.212.110.443: Flags [P.], seq 128:152, ack 1, win 2048, options [nop,nop,TS val 1896577350 ecr 3139883609], length 24
08:53:02.063509 IP 192.168.1.103.65001 > 172.217.19.35.443: Flags [F.], seq 152, ack 1, win 2048, options [nop,nop,TS val 1896577350 ecr 497527142], length 0
08:53:02.063611 IP 192.168.1.103.65002 > 216.58.212.110.443: Flags [F.], seq 152, ack 1, win 2048, options [nop,nop,TS val 1896577351 ecr 3139883609], length 0
08:53:02.141182 IP 172.217.171.196.443 > 192.168.1.103.64993: Flags [P.], seq 1:134, ack 484, win 777, options [nop,nop,TS val 1334800968 ecr 1896576533], length 133
08:53:02.141243 IP 192.168.1.103.64993 > 172.217.171.196.443: Flags [.], ack 134, win 2048, options [nop,nop,TS val 1896577428 ecr 1334800968,nop,nop,sack 1 {1:134}], length 0
08:53:02.243986 IP 192.168.1.103.65026 > 111.221.29.254.443: Flags [S], seq 454623451, win 65535, options [mss 1460,nop,wscale 6,nop,nop,TS val 1896577529 ecr 0,sackOK,eol], length 0
08:53:02.303887 IP 216.58.211.196.443 > 192.168.1.103.64991: Flags [P.], seq 1:1345, ack 422, win 881, options [nop,nop,TS val 3193003875 ecr 1896576537], length 1344
08:53:02.303967 IP 192.168.1.103.64991 > 216.58.211.196.443: Flags [.], ack 1345, win 4263, options [nop,nop,TS val 1896577589 ecr 3193003875,nop,nop,sack 1 {1:1345}], length 0
08:53:02.318492 IP 216.58.211.196.443 > 192.168.1.103.64991: Flags [.], ack 422, win 881, options [nop,nop,TS val 3193003938 ecr 1896576991,nop,nop,sack 1 {0:422}], length 0
08:53:02.403496 IP 172.217.19.35.443 > 192.168.1.103.65001: Flags [P.], seq 1:74, ack 0, win 261, options [nop,nop,TS val 497767143 ecr 1896338313], length 73
08:53:02.418162 IP 172.217.171.196.443 > 192.168.1.103.64993: Flags [.], ack 523, win 777, options [nop,nop,TS val 1334801203 ecr 1896577000], length 0
08:53:02.433187 IP 216.58.212.110.443 > 192.168.1.103.65002: Flags [P.], seq 1:74, ack 0, win 261, options [nop,nop,TS val 3140123617 ecr 1896338318], length 73
08:53:02.448406 IP 195.226.228.72.53 > 192.168.1.103.58900: 28763 0/1/0 (88)
08:53:02.463221 IP 195.226.228.72.53 > 192.168.1.103.60895: 38226 2/0/0 A 162.159.153.4, A 162.159.152.4 (60)
08:53:02.465587 IP 192.168.1.103.65027 > 162.159.153.4.443: Flags [S], seq 409356300, win 65535, options [mss 1460,nop,wscale 6,nop,nop,TS val 1896577745 ecr 0,sackOK,eol], length 0
08:53:02.479390 IP 216.58.211.196.443 > 192.168.1.103.64991: Flags [.], ack 461, win 881, options [nop,nop,TS val 3193004166 ecr 1896577122], length 0
08:53:02.628970 IP 172.217.19.35.443 > 192.168.1.103.65001: Flags [.], ack 46, win 261, options [nop,nop,TS val 497767424 ecr 1896577349], length 0
08:53:02.629039 IP 192.168.1.103.65001 > 172.217.19.35.443: Flags [R], seq 2603608430, win 0, length 0
08:53:02.713790 IP 172.217.19.35.443 > 192.168.1.103.65001: Flags [.], ack 89, win 261, options [nop,nop,TS val 497767475 ecr 1896577349], length 0
08:53:02.713850 IP 192.168.1.103.65001 > 172.217.19.35.443: Flags [R], seq 2603608473, win 0, length 0
08:53:02.727375 IP 172.217.19.35.443 > 192.168.1.103.65001: Flags [P.], seq 74:105, ack 89, win 261, options [nop,nop,TS val 497767476 ecr 1896577349], length 31
08:53:02.727424 IP 192.168.1.103.65001 > 172.217.19.35.443: Flags [R], seq 2603608473, win 0, length 0
08:53:02.742494 IP 172.217.19.35.443 > 192.168.1.103.65001: Flags [P.], seq 74:105, ack 89, win 261, options [nop,nop,TS val 497767478 ecr 1896577349], length 31
08:53:02.742551 IP 192.168.1.103.65001 > 172.217.19.35.443: Flags [R], seq 2603608473, win 0, length 0
08:53:02.756758 IP 172.217.19.35.443 > 192.168.1.103.65001: Flags [.], ack 152, win 261, options [nop,nop,TS val 497767490 ecr 1896577349], length 0
08:53:02.756807 IP 192.168.1.103.65001 > 172.217.19.35.443: Flags [R], seq 2603608536, win 0, length 0
08:53:02.770339 IP 172.217.19.35.443 > 192.168.1.103.65001: Flags [F.], seq 105, ack 152, win 261, options [nop,nop,TS val 497767490 ecr 1896577349], length 0
08:53:02.770394 IP 192.168.1.103.65001 > 172.217.19.35.443: Flags [R], seq 2603608536, win 0, length 0
08:53:02.839679 IP 216.58.212.110.443 > 192.168.1.103.65002: Flags [P.], seq 1:74, ack 0, win 261, options [nop,nop,TS val 3140123972 ecr 1896338318], length 73
08:53:02.839742 IP 192.168.1.103.65002 > 216.58.212.110.443: Flags [R], seq 1337867809, win 0, length 0
08:53:02.853550 IP 216.58.212.110.443 > 192.168.1.103.65002: Flags [.], ack 46, win 261, options [nop,nop,TS val 3140123987 ecr 1896577349], length 0
08:53:02.853602 IP 192.168.1.103.65002 > 216.58.212.110.443: Flags [R], seq 1337867855, win 0, length 0
08:53:02.867618 IP 216.58.212.110.443 > 192.168.1.103.65002: Flags [.], ack 89, win 261, options [nop,nop,TS val 3140124012 ecr 1896577349], length 0
08:53:02.867661 IP 192.168.1.103.65002 > 216.58.212.110.443: Flags [R], seq 1337867898, win 0, length 0
08:53:02.882583 IP 216.58.212.110.443 > 192.168.1.103.65002: Flags [P.], seq 74:105, ack 89, win 261, options [nop,nop,TS val 3140124012 ecr 1896577349], length 31
08:53:02.882644 IP 192.168.1.103.65002 > 216.58.212.110.443: Flags [R], seq 1337867898, win 0, length 0
08:53:02.911676 IP 216.58.212.110.443 > 192.168.1.103.65002: Flags [.], ack 128, win 261, options [nop,nop,TS val 3140124019 ecr 1896577349], length 0
08:53:02.911740 IP 192.168.1.103.65002 > 216.58.212.110.443: Flags [R], seq 1337867937, win 0, length 0
08:53:02.926116 IP 162.159.153.4.443 > 192.168.1.103.65027: Flags [S.], seq 2185462062, ack 409356301, win 65535, options [mss 1400,nop,nop,sackOK,nop,wscale 10], length 0
08:53:02.926202 IP 192.168.1.103.65027 > 162.159.153.4.443: Flags [.], ack 1, win 4096, length 0
08:53:02.927169 IP 192.168.1.103.65027 > 162.159.153.4.443: Flags [P.], seq 1:518, ack 1, win 4096, length 517
08:53:02.981505 IP 216.58.212.110.443 > 192.168.1.103.65002: Flags [.], ack 152, win 261, options [nop,nop,TS val 3140124054 ecr 1896577350], length 0
08:53:02.981563 IP 192.168.1.103.65002 > 216.58.212.110.443: Flags [R], seq 1337867961, win 0, length 0
08:53:02.998148 IP 216.58.212.110.443 > 192.168.1.103.65002: Flags [F.], seq 105, ack 152, win 261, options [nop,nop,TS val 3140124054 ecr 1896577350], length 0
08:53:02.998187 IP 192.168.1.103.65002 > 216.58.212.110.443: Flags [R], seq 1337867961, win 0, length 0
08:53:03.012596 IP 172.217.19.35.443 > 192.168.1.103.65001: Flags [.], ack 153, win 261, options [nop,nop,TS val 497767604 ecr 1896577350], length 0
08:53:03.012640 IP 192.168.1.103.65001 > 172.217.19.35.443: Flags [R], seq 2603608537, win 0, length 0
08:53:03.027267 IP 216.58.212.110.443 > 192.168.1.103.65002: Flags [.], ack 153, win 261, options [nop,nop,TS val 3140124092 ecr 1896577351], length 0
08:53:03.027319 IP 192.168.1.103.65002 > 216.58.212.110.443: Flags [R], seq 1337867962, win 0, length 0
08:53:03.045135 IP 172.217.19.35.443 > 192.168.1.103.65001: Flags [FP.], seq 1:105, ack 153, win 261, options [nop,nop,TS val 497767725 ecr 1896577350], length 104
08:53:03.045192 IP 192.168.1.103.65001 > 172.217.19.35.443: Flags [R], seq 2603608537, win 0, length 0
08:53:03.059874 IP 111.221.29.254.443 > 192.168.1.103.65026: Flags [S.], seq 3103480037, ack 454623452, win 65535, options [mss 1440,nop,wscale 8,nop,nop,sackOK], length 0
08:53:03.059936 IP 192.168.1.103.65026 > 111.221.29.254.443: Flags [.], ack 1, win 4096, length 0
08:53:03.060168 IP 192.168.1.103.65026 > 111.221.29.254.443: Flags [P.], seq 1:518, ack 1, win 4096, length 517
08:53:03.075583 IP 216.58.212.110.443 > 192.168.1.103.65002: Flags [FP.], seq 1:105, ack 153, win 261, options [nop,nop,TS val 3140124326 ecr 1896577351], length 104
08:53:03.075617 IP 192.168.1.103.65002 > 216.58.212.110.443: Flags [R], seq 1337867962, win 0, length 0
08:53:03.140466 IP 162.159.153.4.443 > 192.168.1.103.65027: Flags [.], ack 518, win 66, length 0
08:53:03.166705 IP 162.159.153.4.443 > 192.168.1.103.65027: Flags [.], seq 1:1441, ack 518, win 66, length 1440
08:53:03.166766 IP 192.168.1.103.65027 > 162.159.153.4.443: Flags [.], ack 1441, win 4073, length 0
08:53:03.204562 IP 162.159.153.4.443 > 192.168.1.103.65027: Flags [P.], seq 1441:2464, ack 518, win 66, length 1023
08:53:03.204625 IP 192.168.1.103.65027 > 162.159.153.4.443: Flags [.], ack 2464, win 4080, length 0
08:53:03.214758 IP 192.168.1.103.65027 > 162.159.153.4.443: Flags [P.], seq 518:582, ack 2464, win 4096, length 64
08:53:03.216080 IP 192.168.1.103.65027 > 162.159.153.4.443: Flags [P.], seq 582:628, ack 2464, win 4096, length 46
08:53:03.216105 IP 192.168.1.103.65027 > 162.159.153.4.443: Flags [P.], seq 628:671, ack 2464, win 4096, length 43
08:53:03.216118 IP 192.168.1.103.65027 > 162.159.153.4.443: Flags [P.], seq 671:706, ack 2464, win 4096, length 35
08:53:03.216132 IP 192.168.1.103.65027 > 162.159.153.4.443: Flags [P.], seq 706:1255, ack 2464, win 4096, length 549
08:53:03.502431 IP 162.159.153.4.443 > 192.168.1.103.65027: Flags [.], ack 582, win 66, length 0
08:53:03.520524 IP 162.159.153.4.443 > 192.168.1.103.65027: Flags [P.], seq 2464:2976, ack 582, win 66, length 512
08:53:03.520587 IP 192.168.1.103.65027 > 162.159.153.4.443: Flags [.], ack 2976, win 4088, length 0
08:53:03.521080 IP 192.168.1.103.65027 > 162.159.153.4.443: Flags [P.], seq 1255:1286, ack 2976, win 4096, length 31
08:53:03.535329 IP 162.159.153.4.443 > 192.168.1.103.65027: Flags [.], ack 628, win 66, length 0
08:53:03.626908 IP 111.221.29.254.443 > 192.168.1.103.65026: Flags [.], seq 1:1441, ack 518, win 1027, length 1440
08:53:03.626984 IP 192.168.1.103.65026 > 111.221.29.254.443: Flags [.], ack 1441, win 4073, length 0
08:53:03.646437 IP 111.221.29.254.443 > 192.168.1.103.65026: Flags [.], seq 1441:2881, ack 518, win 1027, length 1440
08:53:03.646499 IP 192.168.1.103.65026 > 111.221.29.254.443: Flags [.], ack 2881, win 4073, length 0
08:53:03.654852 IP 111.221.29.254.443 > 192.168.1.103.65026: Flags [P.], seq 2881:3767, ack 518, win 1027, length 886
08:53:03.654914 IP 192.168.1.103.65026 > 111.221.29.254.443: Flags [.], ack 3767, win 4082, length 0
08:53:03.656189 IP 162.159.153.4.443 > 192.168.1.103.65027: Flags [.], ack 671, win 66, length 0
08:53:03.656678 IP 192.168.1.103.65026 > 111.221.29.254.443: Flags [P.], seq 518:611, ack 3767, win 4096, length 93
08:53:03.657005 IP 162.159.153.4.443 > 192.168.1.103.65027: Flags [P.], seq 2976:3007, ack 671, win 66, length 31
08:53:03.657045 IP 192.168.1.103.65027 > 162.159.153.4.443: Flags [.], ack 3007, win 4095, length 0
08:53:03.671448 IP 162.159.153.4.443 > 192.168.1.103.65027: Flags [.], ack 1255, win 67, length 0
08:53:03.875363 IP 162.159.153.4.443 > 192.168.1.103.65027: Flags [.], ack 1286, win 67, length 0
08:53:04.123238 IP 192.168.1.1.41161 > 255.255.255.255.7437: UDP, length 173
08:53:05.061378 IP 162.159.153.4.443 > 192.168.1.103.65027: Flags [.], seq 12842:14282, ack 1286, win 67, length 1440
08:53:05.061449 IP 192.168.1.103.65027 > 162.159.153.4.443: Flags [.], ack 3007, win 4096, options [nop,nop,sack 1 {12842:14282}], length 0
08:53:05.099878 IP 162.159.153.4.443 > 192.168.1.103.65027: Flags [P.], seq 14282:15722, ack 1286, win 67, length 1440
08:53:05.099956 IP 192.168.1.103.65027 > 162.159.153.4.443: Flags [.], ack 3007, win 4096, options [nop,nop,sack 1 {12842:15722}], length 0
08:53:05.130915 IP 162.159.153.4.443 > 192.168.1.103.65027: Flags [P.], seq 15722:16917, ack 1286, win 67, length 1195
08:53:05.131005 IP 192.168.1.103.65027 > 162.159.153.4.443: Flags [.], ack 3007, win 4096, options [nop,nop,sack 1 {12842:16917}], length 0
08:53:05.171753 IP 162.159.153.4.443 > 192.168.1.103.65027: Flags [.], seq 16917:18357, ack 1286, win 67, length 1440
08:53:05.171817 IP 192.168.1.103.65027 > 162.159.153.4.443: Flags [.], ack 3007, win 4096, options [nop,nop,sack 1 {12842:18357}], length 0
08:53:05.291874 IP 162.159.153.4.443 > 192.168.1.103.65027: Flags [P.], seq 18357:19797, ack 1286, win 67, length 1440
08:53:05.291939 IP 192.168.1.103.65027 > 162.159.153.4.443: Flags [.], ack 3007, win 4096, options [nop,nop,sack 1 {12842:19797}], length 0
08:53:05.301003 IP 192.168.1.103.65026 > 111.221.29.254.443: Flags [P.], seq 518:611, ack 3767, win 4096, length 93
08:53:05.324402 IP 162.159.153.4.443 > 192.168.1.103.65027: Flags [.], seq 19797:21237, ack 1286, win 67, length 1440
08:53:05.324490 IP 192.168.1.103.65027 > 162.159.153.4.443: Flags [.], ack 3007, win 4096, options [nop,nop,sack 1 {12842:21237}], length 0
08:53:05.392371 IP 162.159.153.4.443 > 192.168.1.103.65027: Flags [P.], seq 21237:22677, ack 1286, win 67, length 1440
08:53:05.392438 IP 192.168.1.103.65027 > 162.159.153.4.443: Flags [.], ack 3007, win 4096, options [nop,nop,sack 1 {12842:22677}], length 0
08:53:05.444568 IP 162.159.153.4.443 > 192.168.1.103.65027: Flags [.], seq 22677:24117, ack 1286, win 67, length 1440
08:53:05.444633 IP 192.168.1.103.65027 > 162.159.153.4.443: Flags [.], ack 3007, win 4096, options [nop,nop,sack 1 {12842:24117}], length 0
08:53:05.472515 IP 162.159.153.4.443 > 192.168.1.103.65027: Flags [P.], seq 24117:25557, ack 1286, win 67, length 1440
08:53:05.472575 IP 192.168.1.103.65027 > 162.159.153.4.443: Flags [.], ack 3007, win 4096, options [nop,nop,sack 1 {12842:25557}], length 0
08:53:05.490103 IP 192.168.1.103.64882 > 140.82.121.4.443: Flags [P.], seq 2840653771:2840653848, ack 2525259971, win 2048, options [nop,nop,TS val 1896580745 ecr 233830931], length 77
08:53:05.491816 IP 162.159.153.4.443 > 192.168.1.103.65027: Flags [.], seq 25557:26997, ack 1286, win 67, length 1440
08:53:05.491884 IP 192.168.1.103.65027 > 162.159.153.4.443: Flags [.], ack 3007, win 4096, options [nop,nop,sack 1 {12842:26997}], length 0
08:53:05.531790 IP 162.159.153.4.443 > 192.168.1.103.65027: Flags [P.], seq 26997:28437, ack 1286, win 67, length 1440
08:53:05.531854 IP 192.168.1.103.65027 > 162.159.153.4.443: Flags [.], ack 3007, win 4096, options [nop,nop,sack 1 {12842:28437}], length 0
08:53:05.551325 IP 111.221.29.254.443 > 192.168.1.103.65025: Flags [P.], seq 2327:3767, ack 518, win 2051, length 1440
08:53:05.551397 IP 192.168.1.103.65025 > 111.221.29.254.443: Flags [.], ack 1, win 4096, options [nop,nop,sack 2 {2881:3767}{2327:3767}], length 0
08:53:05.572788 IP 162.159.153.4.443 > 192.168.1.103.65027: Flags [.], seq 28437:29877, ack 1286, win 67, length 1440
08:53:05.572860 IP 192.168.1.103.65027 > 162.159.153.4.443: Flags [.], ack 3007, win 4096, options [nop,nop,sack 1 {12842:29877}], length 0
08:53:05.592922 IP 162.159.153.4.443 > 192.168.1.103.65027: Flags [P.], seq 29877:31317, ack 1286, win 67, length 1440
08:53:05.592987 IP 192.168.1.103.65027 > 162.159.153.4.443: Flags [.], ack 3007, win 4096, options [nop,nop,sack 1 {12842:31317}], length 0
08:53:05.607121 IP 162.159.153.4.443 > 192.168.1.103.65027: Flags [.], seq 31317:32757, ack 1286, win 67, length 1440
08:53:05.607185 IP 192.168.1.103.65027 > 162.159.153.4.443: Flags [.], ack 3007, win 4096, options [nop,nop,sack 1 {12842:32757}], length 0
08:53:05.632860 IP 162.159.153.4.443 > 192.168.1.103.65027: Flags [P.], seq 32757:34197, ack 1286, win 67, length 1440
08:53:05.632927 IP 192.168.1.103.65027 > 162.159.153.4.443: Flags [.], ack 3007, win 4096, options [nop,nop,sack 1 {12842:34197}], length 0
08:53:05.652477 IP 162.159.153.4.443 > 192.168.1.103.65027: Flags [.], seq 34197:35637, ack 1286, win 67, length 1440
08:53:05.652542 IP 192.168.1.103.65027 > 162.159.153.4.443: Flags [.], ack 3007, win 4096, options [nop,nop,sack 1 {12842:35637}], length 0
08:53:05.718215 IP 162.159.153.4.443 > 192.168.1.103.65027: Flags [P.], seq 35637:37077, ack 1286, win 67, length 1440
08:53:05.718281 IP 192.168.1.103.65027 > 162.159.153.4.443: Flags [.], ack 3007, win 4096, options [nop,nop,sack 1 {12842:37077}], length 0
08:53:05.806635 IP 162.159.153.4.443 > 192.168.1.103.65027: Flags [.], seq 37077:38517, ack 1286, win 67, length 1440
