16:46:51.194619 IP6 fe80::fc98:54ff:fef5:13a5 > ff02::1: ICMP6, router advertisement, length 24
16:46:52.315097 IP 192.168.1.103.58479 > 31.13.69.60.443: Flags [P.], seq 1774997420:1774997451, ack 3893060486, win 2048, options [nop,nop,TS val 1954483603 ecr 1962036773], length 31
16:46:52.509567 IP 31.13.69.60.443 > 192.168.1.103.58479: Flags [.], ack 31, win 532, options [nop,nop,TS val 1962050013 ecr 1954483603], length 0
16:46:52.624698 IP 31.13.69.60.443 > 192.168.1.103.58479: Flags [P.], seq 1:39, ack 31, win 532, options [nop,nop,TS val 1962050131 ecr 1954483603], length 38
16:46:52.624760 IP 192.168.1.103.58479 > 31.13.69.60.443: Flags [.], ack 39, win 2047, options [nop,nop,TS val 1954483912 ecr 1962050131], length 0
16:46:53.549937 IP 192.168.1.1.41161 > 255.255.255.255.7437: UDP, length 173
16:46:56.314735 IP6 fe80::fc98:54ff:fef5:13a5 > ff02::1: ICMP6, router advertisement, length 24
16:46:56.622242 IP 192.168.1.1.41161 > 255.255.255.255.7437: UDP, length 173
16:46:59.591927 IP 192.168.1.1.41161 > 255.255.255.255.7437: UDP, length 173
16:47:02.664028 IP 192.168.1.1.41161 > 255.255.255.255.7437: UDP, length 173
16:47:02.991268 IP 192.168.1.103.58479 > 31.13.69.60.443: Flags [P.], seq 31:62, ack 39, win 2048, options [nop,nop,TS val 1954494268 ecr 1962050131], length 31
16:47:03.186541 IP 31.13.69.60.443 > 192.168.1.103.58479: Flags [.], ack 62, win 532, options [nop,nop,TS val 1962060693 ecr 1954494268], length 0
16:47:03.304839 IP 31.13.69.60.443 > 192.168.1.103.58479: Flags [P.], seq 39:77, ack 62, win 532, options [nop,nop,TS val 1962060812 ecr 1954494268], length 38
16:47:03.304902 IP 192.168.1.103.58479 > 31.13.69.60.443: Flags [.], ack 77, win 2047, options [nop,nop,TS val 1954494581 ecr 1962060812], length 0
16:47:03.790224 IP6 fe80::fc98:54ff:fef5:13a5 > ff02::1: ICMP6, router advertisement, length 24
16:47:08.808319 IP 192.168.1.1.41161 > 255.255.255.255.7437: UDP, length 173

16:48:30.158535 IP 192.168.1.103.52232 > 239.255.255.250.1900: UDP, length 174
16:48:30.525863 IP6 fe80::fc98:54ff:fef5:13a5 > ff02::1: ICMP6, router advertisement, length 24
16:48:31.158918 IP 192.168.1.103.52232 > 239.255.255.250.1900: UDP, length 174
16:48:31.447782 IP 192.168.1.1.41161 > 255.255.255.255.7437: UDP, length 173
16:48:32.160813 IP 192.168.1.103.52232 > 239.255.255.250.1900: UDP, length 174
16:48:33.161439 IP 192.168.1.103.52232 > 239.255.255.250.1900: UDP, length 174
16:48:33.331227 IP 192.168.1.103.62379 > 195.226.228.72.53: 50943+ Type65? clients1.google.com. (37)
16:48:33.331479 IP 192.168.1.103.56259 > 195.226.228.72.53: 60554+ A? clients1.google.com. (37)
16:48:33.339350 IP 195.226.228.72.53 > 192.168.1.103.62379: 50943 1/1/0 CNAME clients.l.google.com. (111)
16:48:33.341214 IP 195.226.228.72.53 > 192.168.1.103.56259: 60554 2/0/0 CNAME clients.l.google.com., A 172.217.19.142 (77)
16:48:33.341866 IP 192.168.1.103.49239 > 195.226.228.72.53: 2635+ Type65? clients.l.google.com. (38)
16:48:33.342147 IP 192.168.1.103.50029 > 195.226.228.72.53: 47590+ A? clients.l.google.com. (38)
16:48:33.350974 IP 195.226.228.72.53 > 192.168.1.103.49239: 2635 0/1/0 (88)
16:48:33.352581 IP 195.226.228.72.53 > 192.168.1.103.50029: 47590 1/4/8 A 216.58.205.206 (302)
16:48:33.354253 IP 192.168.1.103.58521 > 172.217.19.142.443: Flags [S], seq 2954760258, win 65535, options [mss 1460,nop,wscale 6,nop,nop,TS val 1954584437 ecr 0,sackOK,eol], length 0
16:48:33.468420 IP 172.217.19.142.443 > 192.168.1.103.58521: Flags [S.], seq 3761556953, ack 2954760259, win 65535, options [mss 1430,sackOK,TS val 2685262767 ecr 1954584437,nop,wscale 8], length 0
16:48:33.468499 IP 192.168.1.103.58521 > 172.217.19.142.443: Flags [.], ack 1, win 2060, options [nop,nop,TS val 1954584551 ecr 2685262767], length 0
16:48:33.480958 IP 192.168.1.103.58521 > 172.217.19.142.443: Flags [P.], seq 1:518, ack 1, win 2060, options [nop,nop,TS val 1954584563 ecr 2685262767], length 517
16:48:33.576786 IP 192.168.1.103.58479 > 31.13.69.60.443: Flags [P.], seq 1774999155:1774999216, ack 3893118946, win 2048, options [nop,nop,TS val 1954584658 ecr 1962146176], length 61
16:48:33.605833 IP 172.217.19.142.443 > 192.168.1.103.58521: Flags [.], ack 518, win 261, options [nop,nop,TS val 2685262907 ecr 1954584563], length 0
16:48:33.628453 IP 172.217.19.142.443 > 192.168.1.103.58521: Flags [.], seq 1:1419, ack 518, win 261, options [nop,nop,TS val 2685262922 ecr 1954584563], length 1418
16:48:33.628504 IP 192.168.1.103.58521 > 172.217.19.142.443: Flags [.], ack 1419, win 2038, options [nop,nop,TS val 1954584709 ecr 2685262922], length 0
16:48:33.633361 IP 172.217.19.142.443 > 192.168.1.103.58521: Flags [.], seq 1419:2837, ack 518, win 261, options [nop,nop,TS val 2685262922 ecr 1954584563], length 1418
16:48:33.633411 IP 192.168.1.103.58521 > 172.217.19.142.443: Flags [.], ack 2837, win 2025, options [nop,nop,TS val 1954584713 ecr 2685262922], length 0
16:48:33.634000 IP 172.217.19.142.443 > 192.168.1.103.58521: Flags [P.], seq 2837:3826, ack 518, win 261, options [nop,nop,TS val 2685262922 ecr 1954584563], length 989
16:48:33.634025 IP 192.168.1.103.58521 > 172.217.19.142.443: Flags [.], ack 3826, win 2032, options [nop,nop,TS val 1954584713 ecr 2685262922], length 0
16:48:33.646542 IP 192.168.1.103.58521 > 172.217.19.142.443: Flags [P.], seq 518:582, ack 3826, win 2048, options [nop,nop,TS val 1954584726 ecr 2685262922], length 64
16:48:33.650039 IP 192.168.1.103.58521 > 172.217.19.142.443: Flags [P.], seq 582:628, ack 3826, win 2048, options [nop,nop,TS val 1954584728 ecr 2685262922], length 46
16:48:33.650067 IP 192.168.1.103.58521 > 172.217.19.142.443: Flags [P.], seq 628:671, ack 3826, win 2048, options [nop,nop,TS val 1954584728 ecr 2685262922], length 43
16:48:33.650081 IP 192.168.1.103.58521 > 172.217.19.142.443: Flags [P.], seq 671:706, ack 3826, win 2048, options [nop,nop,TS val 1954584728 ecr 2685262922], length 35
16:48:33.650096 IP 192.168.1.103.58521 > 172.217.19.142.443: Flags [P.], seq 706:900, ack 3826, win 2048, options [nop,nop,TS val 1954584728 ecr 2685262922], length 194
16:48:33.760744 IP 172.217.19.142.443 > 192.168.1.103.58521: Flags [P.], seq 3826:4406, ack 582, win 261, options [nop,nop,TS val 2685263060 ecr 1954584726], length 580
16:48:33.760798 IP 192.168.1.103.58521 > 172.217.19.142.443: Flags [.], ack 4406, win 2038, options [nop,nop,TS val 1954584839 ecr 2685263060], length 0
16:48:33.764515 IP 172.217.19.142.443 > 192.168.1.103.58521: Flags [.], ack 671, win 261, options [nop,nop,TS val 2685263065 ecr 1954584728], length 0
16:48:33.764735 IP 172.217.19.142.443 > 192.168.1.103.58521: Flags [P.], seq 4406:4437, ack 671, win 261, options [nop,nop,TS val 2685263065 ecr 1954584728], length 31
16:48:33.764762 IP 192.168.1.103.58521 > 172.217.19.142.443: Flags [.], ack 4437, win 2047, options [nop,nop,TS val 1954584842 ecr 2685263065], length 0
16:48:33.765852 IP 192.168.1.103.58521 > 172.217.19.142.443: Flags [P.], seq 900:931, ack 4437, win 2048, options [nop,nop,TS val 1954584843 ecr 2685263065], length 31
16:48:33.766841 IP 31.13.69.60.443 > 192.168.1.103.58479: Flags [.], ack 61, win 532, options [nop,nop,TS val 1962151272 ecr 1954584658], length 0
16:48:33.770384 IP 172.217.19.142.443 > 192.168.1.103.58521: Flags [.], ack 900, win 265, options [nop,nop,TS val 2685263071 ecr 1954584728], length 0
16:48:33.826706 IP 172.217.19.142.443 > 192.168.1.103.58521: Flags [P.], seq 4437:4774, ack 900, win 265, options [nop,nop,TS val 2685263127 ecr 1954584728], length 337
16:48:33.826742 IP 192.168.1.103.58521 > 172.217.19.142.443: Flags [.], ack 4774, win 2042, options [nop,nop,TS val 1954584902 ecr 2685263127], length 0
16:48:33.828604 IP 172.217.19.142.443 > 192.168.1.103.58521: Flags [P.], seq 4774:5212, ack 900, win 265, options [nop,nop,TS val 2685263127 ecr 1954584728], length 438
16:48:33.828646 IP 192.168.1.103.58521 > 172.217.19.142.443: Flags [.], ack 5212, win 2041, options [nop,nop,TS val 1954584903 ecr 2685263127], length 0
16:48:33.829155 IP 172.217.19.142.443 > 192.168.1.103.58521: Flags [P.], seq 5212:5374, ack 900, win 265, options [nop,nop,TS val 2685263128 ecr 1954584728], length 162
16:48:33.829179 IP 192.168.1.103.58521 > 172.217.19.142.443: Flags [.], ack 5374, win 2045, options [nop,nop,TS val 1954584903 ecr 2685263128], length 0
16:48:33.829239 IP 172.217.19.142.443 > 192.168.1.103.58521: Flags [P.], seq 5374:5411, ack 900, win 265, options [nop,nop,TS val 2685263128 ecr 1954584728], length 37
16:48:33.829256 IP 192.168.1.103.58521 > 172.217.19.142.443: Flags [.], ack 5411, win 2044, options [nop,nop,TS val 1954584903 ecr 2685263128], length 0
16:48:33.829579 IP 172.217.19.142.443 > 192.168.1.103.58521: Flags [P.], seq 5411:5450, ack 900, win 265, options [nop,nop,TS val 2685263128 ecr 1954584728], length 39
16:48:33.829596 IP 192.168.1.103.58521 > 172.217.19.142.443: Flags [.], ack 5450, win 2044, options [nop,nop,TS val 1954584903 ecr 2685263128], length 0
16:48:33.831939 IP 192.168.1.103.58521 > 172.217.19.142.443: Flags [P.], seq 931:970, ack 5450, win 2048, options [nop,nop,TS val 1954584906 ecr 2685263128], length 39
16:48:33.849224 IP 192.168.1.103.53524 > 195.226.228.72.53: 13721+ A? youtube-ui.l.google.com. (41)
16:48:33.859290 IP 195.226.228.72.53 > 192.168.1.103.53524: 13721 9/0/0 A 216.58.205.206, A 172.217.21.14, A 172.217.18.238, A 216.58.198.78, A 216.58.212.110, A 172.217.171.206, A 172.217.19.46, A 216.58.211.206, A 172.217.171.238 (185)
16:48:33.861715 IP 192.168.1.103.58522 > 216.58.205.206.443: Flags [S], seq 3883581712, win 65535, options [mss 1460,nop,wscale 6,nop,nop,TS val 1954584935 ecr 0,sackOK,eol], length 0
16:48:33.885375 IP 172.217.19.142.443 > 192.168.1.103.58521: Flags [.], ack 931, win 265, options [nop,nop,TS val 2685263184 ecr 1954584843], length 0
16:48:33.944240 IP 172.217.19.142.443 > 192.168.1.103.58521: Flags [.], ack 970, win 265, options [nop,nop,TS val 2685263245 ecr 1954584906], length 0
16:48:33.978365 IP 216.58.205.206.443 > 192.168.1.103.58522: Flags [S.], seq 2550930564, ack 3883581713, win 65535, options [mss 1430,sackOK,TS val 1973809465 ecr 1954584935,nop,wscale 8], length 0
16:48:33.978435 IP 192.168.1.103.58522 > 216.58.205.206.443: Flags [.], ack 1, win 2060, options [nop,nop,TS val 1954585051 ecr 1973809465], length 0
16:48:33.979085 IP 192.168.1.103.58522 > 216.58.205.206.443: Flags [P.], seq 1:518, ack 1, win 2060, options [nop,nop,TS val 1954585051 ecr 1973809465], length 517
16:48:34.020495 IP 192.168.1.103.58523 > 216.58.205.206.443: Flags [S], seq 1454624937, win 65535, options [mss 1460,nop,wscale 6,nop,nop,TS val 1954585092 ecr 0,sackOK,eol], length 0
16:48:34.104221 IP 216.58.205.206.443 > 192.168.1.103.58522: Flags [.], ack 518, win 261, options [nop,nop,TS val 1973809593 ecr 1954585051], length 0
16:48:34.124719 IP 216.58.205.206.443 > 192.168.1.103.58522: Flags [.], seq 1:1419, ack 518, win 261, options [nop,nop,TS val 1973809607 ecr 1954585051], length 1418
16:48:34.124780 IP 192.168.1.103.58522 > 216.58.205.206.443: Flags [.], ack 1419, win 2038, options [nop,nop,TS val 1954585195 ecr 1973809607], length 0
16:48:34.127496 IP 216.58.205.206.443 > 192.168.1.103.58522: Flags [.], seq 1419:2837, ack 518, win 261, options [nop,nop,TS val 1973809607 ecr 1954585051], length 1418
16:48:34.127543 IP 192.168.1.103.58522 > 216.58.205.206.443: Flags [.], ack 2837, win 2025, options [nop,nop,TS val 1954585197 ecr 1973809607], length 0
16:48:34.129692 IP 216.58.205.206.443 > 192.168.1.103.58522: Flags [P.], seq 2837:3826, ack 518, win 261, options [nop,nop,TS val 1973809607 ecr 1954585051], length 989
16:48:34.129742 IP 192.168.1.103.58522 > 216.58.205.206.443: Flags [.], ack 3826, win 2032, options [nop,nop,TS val 1954585199 ecr 1973809607], length 0
16:48:34.132342 IP 216.58.205.206.443 > 192.168.1.103.58523: Flags [S.], seq 182076796, ack 1454624938, win 65535, options [mss 1430,sackOK,TS val 1919528214 ecr 1954585092,nop,wscale 8], length 0
16:48:34.132396 IP 192.168.1.103.58523 > 216.58.205.206.443: Flags [.], ack 1, win 2060, options [nop,nop,TS val 1954585201 ecr 1919528214], length 0
16:48:34.137634 IP 192.168.1.103.58523 > 216.58.205.206.443: Flags [P.], seq 1:518, ack 1, win 2060, options [nop,nop,TS val 1954585206 ecr 1919528214], length 517
16:48:34.149438 IP 192.168.1.103.58522 > 216.58.205.206.443: Flags [P.], seq 518:582, ack 3826, win 2048, options [nop,nop,TS val 1954585217 ecr 1973809607], length 64
16:48:34.261696 IP 216.58.205.206.443 > 192.168.1.103.58523: Flags [.], ack 518, win 261, options [nop,nop,TS val 1919528342 ecr 1954585206], length 0
16:48:34.264448 IP 216.58.205.206.443 > 192.168.1.103.58522: Flags [P.], seq 3826:4406, ack 582, win 261, options [nop,nop,TS val 1973809752 ecr 1954585217], length 580
16:48:34.264492 IP 192.168.1.103.58522 > 216.58.205.206.443: Flags [.], ack 4406, win 2038, options [nop,nop,TS val 1954585331 ecr 1973809752], length 0
16:48:34.281580 IP 216.58.205.206.443 > 192.168.1.103.58523: Flags [.], seq 1:1419, ack 518, win 261, options [nop,nop,TS val 1919528358 ecr 1954585206], length 1418
16:48:34.281627 IP 192.168.1.103.58523 > 216.58.205.206.443: Flags [.], ack 1419, win 2038, options [nop,nop,TS val 1954585348 ecr 1919528358], length 0
16:48:34.284535 IP 216.58.205.206.443 > 192.168.1.103.58523: Flags [.], seq 1419:2837, ack 518, win 261, options [nop,nop,TS val 1919528358 ecr 1954585206], length 1418
16:48:34.284586 IP 192.168.1.103.58523 > 216.58.205.206.443: Flags [.], ack 2837, win 2025, options [nop,nop,TS val 1954585350 ecr 1919528358], length 0
16:48:34.286689 IP 216.58.205.206.443 > 192.168.1.103.58523: Flags [P.], seq 2837:3827, ack 518, win 261, options [nop,nop,TS val 1919528358 ecr 1954585206], length 990
16:48:34.286721 IP 192.168.1.103.58523 > 216.58.205.206.443: Flags [.], ack 3827, win 2032, options [nop,nop,TS val 1954585352 ecr 1919528358], length 0
16:48:34.293611 IP 192.168.1.103.58523 > 216.58.205.206.443: Flags [P.], seq 518:582, ack 3827, win 2048, options [nop,nop,TS val 1954585358 ecr 1919528358], length 64
16:48:34.295656 IP 192.168.1.103.58523 > 216.58.205.206.443: Flags [P.], seq 582:628, ack 3827, win 2048, options [nop,nop,TS val 1954585360 ecr 1919528358], length 46
16:48:34.295789 IP 192.168.1.103.58523 > 216.58.205.206.443: Flags [P.], seq 628:671, ack 3827, win 2048, options [nop,nop,TS val 1954585360 ecr 1919528358], length 43
16:48:34.295841 IP 192.168.1.103.58523 > 216.58.205.206.443: Flags [P.], seq 671:706, ack 3827, win 2048, options [nop,nop,TS val 1954585360 ecr 1919528358], length 35
16:48:34.295884 IP 192.168.1.103.58523 > 216.58.205.206.443: Flags [P.], seq 706:1899, ack 3827, win 2048, options [nop,nop,TS val 1954585360 ecr 1919528358], length 1193
16:48:34.435469 IP 216.58.205.206.443 > 192.168.1.103.58523: Flags [P.], seq 3827:4407, ack 582, win 261, options [nop,nop,TS val 1919528516 ecr 1954585358], length 580
16:48:34.435504 IP 192.168.1.103.58523 > 216.58.205.206.443: Flags [.], ack 4407, win 2038, options [nop,nop,TS val 1954585498 ecr 1919528516], length 0
16:48:34.435745 IP 192.168.1.103.58523 > 216.58.205.206.443: Flags [P.], seq 1899:1930, ack 4407, win 2048, options [nop,nop,TS val 1954585498 ecr 1919528516], length 31
16:48:34.436537 IP 216.58.205.206.443 > 192.168.1.103.58523: Flags [.], ack 671, win 261, options [nop,nop,TS val 1919528519 ecr 1954585360], length 0
16:48:34.437092 IP 216.58.205.206.443 > 192.168.1.103.58523: Flags [P.], seq 4407:4438, ack 671, win 261, options [nop,nop,TS val 1919528519 ecr 1954585360], length 31
16:48:34.437112 IP 192.168.1.103.58523 > 216.58.205.206.443: Flags [.], ack 4438, win 2047, options [nop,nop,TS val 1954585499 ecr 1919528519], length 0
16:48:34.459878 IP 216.58.205.206.443 > 192.168.1.103.58523: Flags [.], ack 706, win 261, options [nop,nop,TS val 1919528542 ecr 1954585360], length 0
16:48:34.466877 IP 192.168.1.103.58521 > 172.217.19.142.443: Flags [P.], seq 970:1009, ack 5450, win 2048, options [nop,nop,TS val 1954585528 ecr 2685263245], length 39
16:48:34.467238 IP 192.168.1.103.58521 > 172.217.19.142.443: Flags [P.], seq 1009:1033, ack 5450, win 2048, options [nop,nop,TS val 1954585528 ecr 2685263245], length 24
16:48:34.467625 IP 192.168.1.103.58521 > 172.217.19.142.443: Flags [F.], seq 1033, ack 5450, win 2048, options [nop,nop,TS val 1954585528 ecr 2685263245], length 0
16:48:34.481270 IP 216.58.205.206.443 > 192.168.1.103.58523: Flags [.], ack 1899, win 272, options [nop,nop,TS val 1919528563 ecr 1954585360], length 0
16:48:34.519461 IP 192.168.1.1.41161 > 255.255.255.255.7437: UDP, length 173
16:48:34.538672 IP 216.58.205.206.443 > 192.168.1.103.58523: Flags [P.], seq 4438:5108, ack 1899, win 272, options [nop,nop,TS val 1919528619 ecr 1954585360], length 670
16:48:34.538710 IP 192.168.1.103.58523 > 216.58.205.206.443: Flags [.], ack 5108, win 2037, options [nop,nop,TS val 1954585599 ecr 1919528619], length 0
16:48:34.544367 IP 216.58.205.206.443 > 192.168.1.103.58523: Flags [P.], seq 5108:6526, ack 1899, win 272, options [nop,nop,TS val 1919528619 ecr 1954585360], length 1418
16:48:34.544398 IP 192.168.1.103.58523 > 216.58.205.206.443: Flags [.], ack 6526, win 2025, options [nop,nop,TS val 1954585604 ecr 1919528619], length 0
16:48:34.548438 IP 216.58.205.206.443 > 192.168.1.103.58523: Flags [.], seq 6526:7944, ack 1899, win 272, options [nop,nop,TS val 1919528619 ecr 1954585360], length 1418
16:48:34.548472 IP 192.168.1.103.58523 > 216.58.205.206.443: Flags [.], ack 7944, win 2025, options [nop,nop,TS val 1954585608 ecr 1919528619], length 0
16:48:34.551406 IP 216.58.205.206.443 > 192.168.1.103.58523: Flags [.], seq 7944:9362, ack 1899, win 272, options [nop,nop,TS val 1919528619 ecr 1954585360], length 1418
16:48:34.551449 IP 192.168.1.103.58523 > 216.58.205.206.443: Flags [.], ack 9362, win 2025, options [nop,nop,TS val 1954585610 ecr 1919528619], length 0
16:48:34.555090 IP 216.58.205.206.443 > 192.168.1.103.58523: Flags [.], seq 9362:10780, ack 1899, win 272, options [nop,nop,TS val 1919528619 ecr 1954585360], length 1418
16:48:34.555126 IP 192.168.1.103.58523 > 216.58.205.206.443: Flags [.], ack 10780, win 2025, options [nop,nop,TS val 1954585613 ecr 1919528619], length 0
16:48:34.558459 IP 216.58.205.206.443 > 192.168.1.103.58523: Flags [.], seq 10780:12198, ack 1899, win 272, options [nop,nop,TS val 1919528619 ecr 1954585360], length 1418
16:48:34.558494 IP 192.168.1.103.58523 > 216.58.205.206.443: Flags [.], ack 12198, win 2025, options [nop,nop,TS val 1954585616 ecr 1919528619], length 0
16:48:34.562019 IP 216.58.205.206.443 > 192.168.1.103.58523: Flags [.], seq 12198:13616, ack 1899, win 272, options [nop,nop,TS val 1919528627 ecr 1954585360], length 1418
16:48:34.562057 IP 192.168.1.103.58523 > 216.58.205.206.443: Flags [.], ack 13616, win 2025, options [nop,nop,TS val 1954585619 ecr 1919528627], length 0
16:48:34.568820 IP 216.58.205.206.443 > 192.168.1.103.58523: Flags [.], seq 13616:15034, ack 1899, win 272, options [nop,nop,TS val 1919528627 ecr 1954585360], length 1418
16:48:34.568859 IP 192.168.1.103.58523 > 216.58.205.206.443: Flags [.], ack 15034, win 2025, options [nop,nop,TS val 1954585625 ecr 1919528627], length 0
16:48:34.569262 IP 216.58.205.206.443 > 192.168.1.103.58523: Flags [.], seq 15034:16452, ack 1899, win 272, options [nop,nop,TS val 1919528635 ecr 1954585360], length 1418
16:48:34.569288 IP 192.168.1.103.58523 > 216.58.205.206.443: Flags [.], ack 16452, win 2003, options [nop,nop,TS val 1954585625 ecr 1919528635], length 0
16:48:34.569532 IP 192.168.1.103.58523 > 216.58.205.206.443: Flags [.], ack 16452, win 2048, options [nop,nop,TS val 1954585625 ecr 1919528635], length 0
16:48:34.570653 IP 216.58.205.206.443 > 192.168.1.103.58523: Flags [.], seq 16452:17870, ack 1899, win 272, options [nop,nop,TS val 1919528635 ecr 1954585360], length 1418
16:48:34.570687 IP 192.168.1.103.58523 > 216.58.205.206.443: Flags [.], ack 17870, win 2025, options [nop,nop,TS val 1954585626 ecr 1919528635], length 0
16:48:34.573535 IP 216.58.205.206.443 > 192.168.1.103.58523: Flags [.], seq 17870:19288, ack 1899, win 272, options [nop,nop,TS val 1919528643 ecr 1954585498], length 1418
16:48:34.573969 IP 192.168.1.103.58523 > 216.58.205.206.443: Flags [.], ack 19288, win 2048, options [nop,nop,TS val 1954585628 ecr 1919528643], length 0
16:48:34.577337 IP 216.58.205.206.443 > 192.168.1.103.58523: Flags [.], seq 19288:20706, ack 1899, win 272, options [nop,nop,TS val 1919528643 ecr 1954585498], length 1418
16:48:34.577805 IP 192.168.1.103.56607 > 195.226.228.72.53: 50471+ Type65? i.ytimg.com. (29)
16:48:34.578103 IP 192.168.1.103.60652 > 195.226.228.72.53: 50344+ A? i.ytimg.com. (29)
16:48:34.580932 IP 216.58.205.206.443 > 192.168.1.103.58523: Flags [.], seq 20706:22124, ack 1930, win 272, options [nop,nop,TS val 1919528650 ecr 1954585499], length 1418
16:48:34.580970 IP 192.168.1.103.58523 > 216.58.205.206.443: Flags [.], ack 22124, win 2025, options [nop,nop,TS val 1954585634 ecr 1919528643], length 0
16:48:34.581349 IP 172.217.19.142.443 > 192.168.1.103.58521: Flags [.], ack 1009, win 265, options [nop,nop,TS val 2685263880 ecr 1954585528], length 0
16:48:34.583071 IP 216.58.205.206.443 > 192.168.1.103.58523: Flags [.], seq 22124:23542, ack 1930, win 272, options [nop,nop,TS val 1919528650 ecr 1954585499], length 1418
16:48:34.583358 IP 216.58.205.206.443 > 192.168.1.103.58523: Flags [.], ack 1930, win 272, options [nop,nop,TS val 1919528650 ecr 1954585498], length 0
16:48:34.583393 IP 192.168.1.103.58523 > 216.58.205.206.443: Flags [.], ack 23542, win 2025, options [nop,nop,TS val 1954585636 ecr 1919528650], length 0
16:48:34.583553 IP 172.217.19.142.443 > 192.168.1.103.58521: Flags [.], ack 1033, win 265, options [nop,nop,TS val 2685263882 ecr 1954585528], length 0
16:48:34.587884 IP 216.58.205.206.443 > 192.168.1.103.58523: Flags [.], seq 23542:24960, ack 1930, win 272, options [nop,nop,TS val 1919528658 ecr 1954585499], length 1418
16:48:34.588021 IP 192.168.1.103.58523 > 216.58.205.206.443: Flags [.], ack 24960, win 2048, options [nop,nop,TS val 1954585639 ecr 1919528658], length 0
16:48:34.588133 IP 172.217.19.142.443 > 192.168.1.103.58521: Flags [F.], seq 5450, ack 1033, win 265, options [nop,nop,TS val 2685263882 ecr 1954585528], length 0
16:48:34.588155 IP 192.168.1.103.58521 > 172.217.19.142.443: Flags [F.], seq 1033, ack 5451, win 2048, options [nop,nop,TS val 1954585639 ecr 2685263882], length 0
16:48:34.588461 IP 172.217.19.142.443 > 192.168.1.103.58521: Flags [.], ack 1034, win 265, options [nop,nop,TS val 2685263883 ecr 1954585528], length 0
16:48:34.588724 IP 195.226.228.72.53 > 192.168.1.103.56607: 50471 0/1/0 (86)
16:48:34.590059 IP 195.226.228.72.53 > 192.168.1.103.60652: 50344 1/4/8 A 216.58.205.214 (300)
16:48:34.591747 IP 192.168.1.103.58524 > 216.58.205.214.443: Flags [S], seq 2045254256, win 65535, options [mss 1460,nop,wscale 6,nop,nop,TS val 1954585642 ecr 0,sackOK,eol], length 0
16:48:34.657434 IP 216.58.205.206.443 > 192.168.1.103.58523: Flags [.], seq 24960:26378, ack 1930, win 272, options [nop,nop,TS val 1919528732 ecr 1954585599], length 1418
16:48:34.658110 IP 216.58.205.206.443 > 192.168.1.103.58523: Flags [.], seq 26378:27796, ack 1930, win 272, options [nop,nop,TS val 1919528732 ecr 1954585599], length 1418
16:48:34.658145 IP 192.168.1.103.58523 > 216.58.205.206.443: Flags [.], ack 27796, win 2025, options [nop,nop,TS val 1954585707 ecr 1919528732], length 0
16:48:34.660011 IP 216.58.205.206.443 > 192.168.1.103.58523: Flags [P.], seq 27796:28576, ack 1930, win 272, options [nop,nop,TS val 1919528738 ecr 1954585604], length 780
16:48:34.660045 IP 192.168.1.103.58523 > 216.58.205.206.443: Flags [.], ack 28576, win 2035, options [nop,nop,TS val 1954585709 ecr 1919528738], length 0
16:48:34.664410 IP 192.168.1.103.58525 > 216.58.205.206.443: Flags [S], seq 4143553384, win 65535, options [mss 1460,nop,wscale 6,nop,nop,TS val 1954585713 ecr 0,sackOK,eol], length 0
16:48:34.713798 IP 216.58.205.214.443 > 192.168.1.103.58524: Flags [S.], seq 2942202579, ack 2045254257, win 65535, options [mss 1430,sackOK,TS val 1827171138 ecr 1954585642,nop,wscale 8], length 0
16:48:34.713865 IP 192.168.1.103.58524 > 216.58.205.214.443: Flags [.], ack 1, win 2060, options [nop,nop,TS val 1954585762 ecr 1827171138], length 0
16:48:34.714857 IP 192.168.1.103.58524 > 216.58.205.214.443: Flags [P.], seq 1:518, ack 1, win 2060, options [nop,nop,TS val 1954585763 ecr 1827171138], length 517
16:48:34.775915 IP 216.58.205.206.443 > 192.168.1.103.58525: Flags [S.], seq 1898298125, ack 4143553385, win 65535, options [mss 1430,sackOK,TS val 1882825031 ecr 1954585713,nop,wscale 8], length 0
16:48:34.775967 IP 192.168.1.103.58525 > 216.58.205.206.443: Flags [.], ack 1, win 2060, options [nop,nop,TS val 1954585823 ecr 1882825031], length 0
16:48:34.776422 IP 192.168.1.103.58525 > 216.58.205.206.443: Flags [P.], seq 1:518, ack 1, win 2060, options [nop,nop,TS val 1954585823 ecr 1882825031], length 517
16:48:34.839657 IP 216.58.205.214.443 > 192.168.1.103.58524: Flags [.], ack 518, win 261, options [nop,nop,TS val 1827171264 ecr 1954585763], length 0
16:48:34.861487 IP 216.58.205.214.443 > 192.168.1.103.58524: Flags [.], seq 1:1419, ack 518, win 261, options [nop,nop,TS val 1827171280 ecr 1954585763], length 1418
16:48:34.861536 IP 192.168.1.103.58524 > 216.58.205.214.443: Flags [.], ack 1419, win 2038, options [nop,nop,TS val 1954585907 ecr 1827171280], length 0
16:48:34.865302 IP 216.58.205.214.443 > 192.168.1.103.58524: Flags [.], seq 1419:2837, ack 518, win 261, options [nop,nop,TS val 1827171280 ecr 1954585763], length 1418
16:48:34.865361 IP 192.168.1.103.58524 > 216.58.205.214.443: Flags [.], ack 2837, win 2025, options [nop,nop,TS val 1954585910 ecr 1827171280], length 0
16:48:34.865557 IP 216.58.205.214.443 > 192.168.1.103.58524: Flags [P.], seq 2837:3097, ack 518, win 261, options [nop,nop,TS val 1827171280 ecr 1954585763], length 260
16:48:34.865616 IP 192.168.1.103.58524 > 216.58.205.214.443: Flags [.], ack 3097, win 2043, options [nop,nop,TS val 1954585910 ecr 1827171280], length 0
16:48:34.874521 IP 192.168.1.103.58524 > 216.58.205.214.443: Flags [P.], seq 518:582, ack 3097, win 2048, options [nop,nop,TS val 1954585919 ecr 1827171280], length 64
16:48:34.877918 IP 192.168.1.103.58524 > 216.58.205.214.443: Flags [P.], seq 582:628, ack 3097, win 2048, options [nop,nop,TS val 1954585921 ecr 1827171280], length 46
16:48:34.877948 IP 192.168.1.103.58524 > 216.58.205.214.443: Flags [P.], seq 628:671, ack 3097, win 2048, options [nop,nop,TS val 1954585921 ecr 1827171280], length 43
16:48:34.877959 IP 192.168.1.103.58524 > 216.58.205.214.443: Flags [P.], seq 671:706, ack 3097, win 2048, options [nop,nop,TS val 1954585921 ecr 1827171280], length 35
16:48:34.877972 IP 192.168.1.103.58524 > 216.58.205.214.443: Flags [P.], seq 706:898, ack 3097, win 2048, options [nop,nop,TS val 1954585921 ecr 1827171280], length 192
16:48:34.902729 IP 216.58.205.206.443 > 192.168.1.103.58525: Flags [.], ack 518, win 261, options [nop,nop,TS val 1882825156 ecr 1954585823], length 0
16:48:34.921757 IP 216.58.205.206.443 > 192.168.1.103.58525: Flags [.], seq 1:1419, ack 518, win 261, options [nop,nop,TS val 1882825171 ecr 1954585823], length 1418
16:48:34.921817 IP 192.168.1.103.58525 > 216.58.205.206.443: Flags [.], ack 1419, win 2038, options [nop,nop,TS val 1954585964 ecr 1882825171], length 0
16:48:34.924680 IP 216.58.205.206.443 > 192.168.1.103.58525: Flags [.], seq 1419:2837, ack 518, win 261, options [nop,nop,TS val 1882825171 ecr 1954585823], length 1418
16:48:34.924733 IP 192.168.1.103.58525 > 216.58.205.206.443: Flags [.], ack 2837, win 2025, options [nop,nop,TS val 1954585966 ecr 1882825171], length 0
16:48:34.928804 IP 216.58.205.206.443 > 192.168.1.103.58525: Flags [P.], seq 2837:3826, ack 518, win 261, options [nop,nop,TS val 1882825171 ecr 1954585823], length 989
16:48:34.928868 IP 192.168.1.103.58525 > 216.58.205.206.443: Flags [.], ack 3826, win 2032, options [nop,nop,TS val 1954585970 ecr 1882825171], length 0
16:48:34.940449 IP 192.168.1.103.58525 > 216.58.205.206.443: Flags [P.], seq 518:582, ack 3826, win 2048, options [nop,nop,TS val 1954585981 ecr 1882825171], length 64
16:48:34.941704 IP 31.13.69.60.443 > 192.168.1.103.58479: Flags [P.], seq 1:55, ack 61, win 532, options [nop,nop,TS val 1962152447 ecr 1954584658], length 54
16:48:34.941757 IP 192.168.1.103.58479 > 31.13.69.60.443: Flags [.], ack 55, win 2047, options [nop,nop,TS val 1954585982 ecr 1962152447], length 0
16:48:34.942915 IP 192.168.1.103.58525 > 216.58.205.206.443: Flags [P.], seq 582:628, ack 3826, win 2048, options [nop,nop,TS val 1954585983 ecr 1882825171], length 46
16:48:34.942967 IP 192.168.1.103.58525 > 216.58.205.206.443: Flags [P.], seq 628:671, ack 3826, win 2048, options [nop,nop,TS val 1954585983 ecr 1882825171], length 43
16:48:34.942988 IP 192.168.1.103.58525 > 216.58.205.206.443: Flags [P.], seq 671:706, ack 3826, win 2048, options [nop,nop,TS val 1954585983 ecr 1882825171], length 35
16:48:34.943009 IP 192.168.1.103.58525 > 216.58.205.206.443: Flags [P.], seq 706:1935, ack 3826, win 2048, options [nop,nop,TS val 1954585983 ecr 1882825171], length 1229
16:48:34.989268 IP 216.58.205.214.443 > 192.168.1.103.58524: Flags [P.], seq 3097:3677, ack 582, win 261, options [nop,nop,TS val 1827171412 ecr 1954585919], length 580
16:48:34.989339 IP 192.168.1.103.58524 > 216.58.205.214.443: Flags [.], ack 3677, win 2038, options [nop,nop,TS val 1954586029 ecr 1827171412], length 0
16:48:34.989879 IP 192.168.1.103.58524 > 216.58.205.214.443: Flags [P.], seq 898:929, ack 3677, win 2048, options [nop,nop,TS val 1954586029 ecr 1827171412], length 31
16:48:34.992956 IP 216.58.205.214.443 > 192.168.1.103.58524: Flags [.], ack 671, win 261, options [nop,nop,TS val 1827171418 ecr 1954585921], length 0
16:48:34.993151 IP 216.58.205.214.443 > 192.168.1.103.58524: Flags [P.], seq 3677:3708, ack 671, win 261, options [nop,nop,TS val 1827171418 ecr 1954585921], length 31
16:48:34.993203 IP 192.168.1.103.58524 > 216.58.205.214.443: Flags [.], ack 3708, win 2047, options [nop,nop,TS val 1954586032 ecr 1827171418], length 0
16:48:34.997376 IP 216.58.205.214.443 > 192.168.1.103.58524: Flags [.], ack 898, win 265, options [nop,nop,TS val 1827171422 ecr 1954585921], length 0
16:48:34.998082 IP 216.58.205.214.443 > 192.168.1.103.58524: Flags [P.], seq 3708:3926, ack 898, win 265, options [nop,nop,TS val 1827171423 ecr 1954585921], length 218
16:48:34.998145 IP 192.168.1.103.58524 > 216.58.205.214.443: Flags [.], ack 3926, win 2044, options [nop,nop,TS val 1954586036 ecr 1827171423], length 0
16:48:34.998684 IP 192.168.1.103.58524 > 216.58.205.214.443: Flags [P.], seq 929:968, ack 3926, win 2048, options [nop,nop,TS val 1954586037 ecr 1827171423], length 39
16:48:35.022078 IP 192.168.1.103.58525 > 216.58.205.206.443: Flags [P.], seq 1935:2069, ack 3826, win 2048, options [nop,nop,TS val 1954586060 ecr 1882825171], length 134
16:48:35.058026 IP 216.58.205.206.443 > 192.168.1.103.58525: Flags [P.], seq 3826:4406, ack 582, win 261, options [nop,nop,TS val 1882825311 ecr 1954585981], length 580
16:48:35.058096 IP 192.168.1.103.58525 > 216.58.205.206.443: Flags [.], ack 4406, win 2038, options [nop,nop,TS val 1954586095 ecr 1882825311], length 0
16:48:35.058742 IP 192.168.1.103.58525 > 216.58.205.206.443: Flags [P.], seq 2069:2100, ack 4406, win 2048, options [nop,nop,TS val 1954586095 ecr 1882825311], length 31
16:48:35.061017 IP 216.58.205.206.443 > 192.168.1.103.58525: Flags [.], ack 671, win 261, options [nop,nop,TS val 1882825316 ecr 1954585983], length 0
16:48:35.061018 IP 216.58.205.206.443 > 192.168.1.103.58525: Flags [P.], seq 4406:4437, ack 671, win 261, options [nop,nop,TS val 1882825316 ecr 1954585983], length 31
16:48:35.061085 IP 192.168.1.103.58525 > 216.58.205.206.443: Flags [.], ack 4437, win 2047, options [nop,nop,TS val 1954586097 ecr 1882825316], length 0
16:48:35.066976 IP 216.58.205.206.443 > 192.168.1.103.58525: Flags [.], ack 706, win 261, options [nop,nop,TS val 1882825322 ecr 1954585983], length 0
16:48:35.093464 IP 216.58.205.206.443 > 192.168.1.103.58525: Flags [.], ack 1935, win 272, options [nop,nop,TS val 1882825348 ecr 1954585983], length 0
16:48:35.096699 IP 216.58.205.206.443 > 192.168.1.103.58525: Flags [P.], seq 4437:4829, ack 1935, win 272, options [nop,nop,TS val 1882825350 ecr 1954585983], length 392
16:48:35.096781 IP 192.168.1.103.58525 > 216.58.205.206.443: Flags [.], ack 4829, win 2041, options [nop,nop,TS val 1954586131 ecr 1882825350], length 0
16:48:35.098091 IP 216.58.205.206.443 > 192.168.1.103.58525: Flags [P.], seq 4829:5558, ack 1935, win 272, options [nop,nop,TS val 1882825350 ecr 1954585983], length 729
16:48:35.098143 IP 192.168.1.103.58525 > 216.58.205.206.443: Flags [.], ack 5558, win 2036, options [nop,nop,TS val 1954586132 ecr 1882825350], length 0
16:48:35.098587 IP 216.58.205.206.443 > 192.168.1.103.58525: Flags [P.], seq 5558:5597, ack 1935, win 272, options [nop,nop,TS val 1882825350 ecr 1954585983], length 39
16:48:35.098616 IP 192.168.1.103.58525 > 216.58.205.206.443: Flags [.], ack 5597, win 2047, options [nop,nop,TS val 1954586132 ecr 1882825350], length 0
16:48:35.105981 IP 192.168.1.103.58525 > 216.58.205.206.443: Flags [P.], seq 2100:2139, ack 5597, win 2048, options [nop,nop,TS val 1954586139 ecr 1882825350], length 39
16:48:35.108960 IP 216.58.205.214.443 > 192.168.1.103.58524: Flags [.], ack 929, win 265, options [nop,nop,TS val 1827171534 ecr 1954586029], length 0
16:48:35.113663 IP 216.58.205.214.443 > 192.168.1.103.58524: Flags [.], ack 968, win 265, options [nop,nop,TS val 1827171539 ecr 1954586037], length 0
16:48:35.142459 IP 216.58.205.206.443 > 192.168.1.103.58525: Flags [.], ack 2069, win 281, options [nop,nop,TS val 1882825397 ecr 1954586060], length 0
16:48:35.171461 IP 216.58.205.206.443 > 192.168.1.103.58525: Flags [.], ack 2100, win 281, options [nop,nop,TS val 1882825427 ecr 1954586095], length 0
16:48:35.173812 IP 216.58.205.206.443 > 192.168.1.103.58525: Flags [P.], seq 5597:6055, ack 2100, win 281, options [nop,nop,TS val 1882825428 ecr 1954586097], length 458
16:48:35.173854 IP 192.168.1.103.58525 > 216.58.205.206.443: Flags [.], ack 6055, win 2040, options [nop,nop,TS val 1954586204 ecr 1882825428], length 0
16:48:35.174957 IP 216.58.205.206.443 > 192.168.1.103.58525: Flags [P.], seq 6055:6627, ack 2100, win 281, options [nop,nop,TS val 1882825428 ecr 1954586097], length 572
16:48:35.174983 IP 192.168.1.103.58525 > 216.58.205.206.443: Flags [.], ack 6627, win 2031, options [nop,nop,TS val 1954586205 ecr 1882825428], length 0
16:48:35.175369 IP 216.58.205.206.443 > 192.168.1.103.58525: Flags [P.], seq 6627:6659, ack 2100, win 281, options [nop,nop,TS val 1882825429 ecr 1954586097], length 32
16:48:35.175389 IP 192.168.1.103.58525 > 216.58.205.206.443: Flags [.], ack 6659, win 2031, options [nop,nop,TS val 1954586205 ecr 1882825429], length 0
16:48:35.175684 IP 216.58.205.206.443 > 192.168.1.103.58525: Flags [P.], seq 6659:6690, ack 2100, win 281, options [nop,nop,TS val 1882825429 ecr 1954586097], length 31
16:48:35.175704 IP 192.168.1.103.58525 > 216.58.205.206.443: Flags [.], ack 6690, win 2030, options [nop,nop,TS val 1954586205 ecr 1882825429], length 0
16:48:35.223116 IP 216.58.205.206.443 > 192.168.1.103.58525: Flags [.], ack 2139, win 281, options [nop,nop,TS val 1882825478 ecr 1954586139], length 0
16:48:35.379986 IP 192.168.1.103 > 224.0.0.22: igmp v3 report, 1 group record(s)
16:48:35.441247 IP6 fe80::fc98:54ff:fef5:13a5 > ff02::1: ICMP6, router advertisement, length 24
16:48:35.462958 IP 216.58.205.206.443 > 192.168.1.103.58523: Flags [P.], seq 28576:28646, ack 1930, win 272, options [nop,nop,TS val 1919529545 ecr 1954585709], length 70
16:48:35.463080 IP 192.168.1.103.58523 > 216.58.205.206.443: Flags [.], ack 28646, win 2046, options [nop,nop,TS val 1954586490 ecr 1919529545], length 0
16:48:35.487099 IP 216.58.205.206.443 > 192.168.1.103.58523: Flags [P.], seq 28646:30064, ack 1930, win 272, options [nop,nop,TS val 1919529562 ecr 1954585709], length 1418
16:48:35.490498 IP 216.58.205.206.443 > 192.168.1.103.58523: Flags [.], seq 30064:31482, ack 1930, win 272, options [nop,nop,TS val 1919529564 ecr 1954585709], length 1418
16:48:35.490536 IP 192.168.1.103.58523 > 216.58.205.206.443: Flags [.], ack 31482, win 2002, options [nop,nop,TS val 1954586517 ecr 1919529562], length 0
16:48:35.493993 IP 216.58.205.206.443 > 192.168.1.103.58523: Flags [P.], seq 31482:32900, ack 1930, win 272, options [nop,nop,TS val 1919529564 ecr 1954585709], length 1418
16:48:35.496772 IP 216.58.205.206.443 > 192.168.1.103.58523: Flags [P.], seq 32900:33915, ack 1930, win 272, options [nop,nop,TS val 1919529569 ecr 1954585709], length 1015
16:48:35.496813 IP 192.168.1.103.58523 > 216.58.205.206.443: Flags [.], ack 33915, win 1964, options [nop,nop,TS val 1954586522 ecr 1919529564], length 0
16:48:35.498760 IP 216.58.205.206.443 > 192.168.1.103.58523: Flags [.], seq 33915:35333, ack 1930, win 272, options [nop,nop,TS val 1919529571 ecr 1954585709], length 1418
16:48:35.502456 IP 216.58.205.206.443 > 192.168.1.103.58523: Flags [.], seq 35333:36751, ack 1930, win 272, options [nop,nop,TS val 1919529571 ecr 1954585709], length 1418
16:48:35.502491 IP 192.168.1.103.58523 > 216.58.205.206.443: Flags [.], ack 36751, win 1920, options [nop,nop,TS val 1954586527 ecr 1919529571], length 0
16:48:35.504334 IP 192.168.1.103.58523 > 216.58.205.206.443: Flags [.], ack 36751, win 2048, options [nop,nop,TS val 1954586528 ecr 1919529571], length 0
16:48:35.505777 IP 216.58.205.206.443 > 192.168.1.103.58523: Flags [.], seq 36751:38169, ack 1930, win 272, options [nop,nop,TS val 1919529576 ecr 1954585709], length 1418
16:48:35.508523 IP 216.58.205.206.443 > 192.168.1.103.58523: Flags [.], seq 38169:39587, ack 1930, win 272, options [nop,nop,TS val 1919529576 ecr 1954585709], length 1418
16:48:35.508562 IP 192.168.1.103.58523 > 216.58.205.206.443: Flags [.], ack 39587, win 2025, options [nop,nop,TS val 1954586531 ecr 1919529576], length 0
16:48:35.512565 IP 216.58.205.206.443 > 192.168.1.103.58523: Flags [.], seq 39587:41005, ack 1930, win 272, options [nop,nop,TS val 1919529581 ecr 1954585709], length 1418
16:48:35.515323 IP 216.58.205.206.443 > 192.168.1.103.58523: Flags [.], seq 41005:42423, ack 1930, win 272, options [nop,nop,TS val 1919529581 ecr 1954585709], length 1418
16:48:35.515368 IP 192.168.1.103.58523 > 216.58.205.206.443: Flags [.], ack 42423, win 2003, options [nop,nop,TS val 1954586536 ecr 1919529581], length 0
16:48:35.518399 IP 216.58.205.206.443 > 192.168.1.103.58523: Flags [.], seq 42423:43841, ack 1930, win 272, options [nop,nop,TS val 1919529586 ecr 1954585709], length 1418
16:48:35.521278 IP 192.168.1.103.58523 > 216.58.205.206.443: Flags [.], ack 43841, win 2048, options [nop,nop,TS val 1954586541 ecr 1919529586], length 0
16:48:35.521818 IP 216.58.205.206.443 > 192.168.1.103.58523: Flags [.], seq 43841:45259, ack 1930, win 272, options [nop,nop,TS val 1919529586 ecr 1954585709], length 1418
16:48:35.525359 IP 216.58.205.206.443 > 192.168.1.103.58523: Flags [.], seq 45259:46677, ack 1930, win 272, options [nop,nop,TS val 1919529592 ecr 1954585709], length 1418
16:48:35.525409 IP 192.168.1.103.58523 > 216.58.205.206.443: Flags [.], ack 46677, win 2003, options [nop,nop,TS val 1954586545 ecr 1919529586], length 0
16:48:35.527375 IP 192.168.1.103.58523 > 216.58.205.206.443: Flags [.], ack 46677, win 2048, options [nop,nop,TS val 1954586546 ecr 1919529586], length 0
16:48:35.529051 IP 216.58.205.206.443 > 192.168.1.103.58523: Flags [.], seq 46677:48095, ack 1930, win 272, options [nop,nop,TS val 1919529592 ecr 1954585709], length 1418
16:48:35.531476 IP 216.58.205.206.443 > 192.168.1.103.58523: Flags [.], seq 48095:49513, ack 1930, win 272, options [nop,nop,TS val 1919529597 ecr 1954585709], length 1418
16:48:35.531521 IP 192.168.1.103.58523 > 216.58.205.206.443: Flags [.], ack 49513, win 2003, options [nop,nop,TS val 1954586549 ecr 1919529592], length 0
